,candidatura,nombre,nombre_completo,numero,partido,siglas,suplente
1274,22,Angela, Ángela Rosa Vallina de la Noval.,6,"IZQUIERDA UNIDA, INICIATIVA PER CATALUNYA VERDS, ESQUERRA UNIDA I ALTERNATIVA, ANOVA-IRMANDADE NACIONALISTA, ESPAZO ECOSOCIALISTA GALEGO, BATZARRE-ASAMBLEA DE IZQUIERDAS, FEDERACION LOS VERDES, OPCIÓ VERDA-ELS VERDS, GIRA MADRID-LOS VERDES, CONSTRUYENDO LA IZQUIERDA-ALTERNATIVA SOCIALISTA, EZKERREKO EKIMENA-ETORKIZUNA IRATZARRI: LA IZQUIERDA PLURAL",IZQUIERDA PLURAL,False
1275,22,Javier, Javier Couso Permuy.,7,"IZQUIERDA UNIDA, INICIATIVA PER CATALUNYA VERDS, ESQUERRA UNIDA I ALTERNATIVA, ANOVA-IRMANDADE NACIONALISTA, ESPAZO ECOSOCIALISTA GALEGO, BATZARRE-ASAMBLEA DE IZQUIERDAS, FEDERACION LOS VERDES, OPCIÓ VERDA-ELS VERDS, GIRA MADRID-LOS VERDES, CONSTRUYENDO LA IZQUIERDA-ALTERNATIVA SOCIALISTA, EZKERREKO EKIMENA-ETORKIZUNA IRATZARRI: LA IZQUIERDA PLURAL",IZQUIERDA PLURAL,False
1276,22,Anastasio, Anastasio Oliver Palomo.,8,"IZQUIERDA UNIDA, INICIATIVA PER CATALUNYA VERDS, ESQUERRA UNIDA I ALTERNATIVA, ANOVA-IRMANDADE NACIONALISTA, ESPAZO ECOSOCIALISTA GALEGO, BATZARRE-ASAMBLEA DE IZQUIERDAS, FEDERACION LOS VERDES, OPCIÓ VERDA-ELS VERDS, GIRA MADRID-LOS VERDES, CONSTRUYENDO LA IZQUIERDA-ALTERNATIVA SOCIALISTA, EZKERREKO EKIMENA-ETORKIZUNA IRATZARRI: LA IZQUIERDA PLURAL",IZQUIERDA PLURAL,False
1277,22,Nuria, Nuria Lozano Montoya (EUiA).,9,"IZQUIERDA UNIDA, INICIATIVA PER CATALUNYA VERDS, ESQUERRA UNIDA I ALTERNATIVA, ANOVA-IRMANDADE NACIONALISTA, ESPAZO ECOSOCIALISTA GALEGO, BATZARRE-ASAMBLEA DE IZQUIERDAS, FEDERACION LOS VERDES, OPCIÓ VERDA-ELS VERDS, GIRA MADRID-LOS VERDES, CONSTRUYENDO LA IZQUIERDA-ALTERNATIVA SOCIALISTA, EZKERREKO EKIMENA-ETORKIZUNA IRATZARRI: LA IZQUIERDA PLURAL",IZQUIERDA PLURAL,False
1278,22,Lara, Lara Hernández García.,10,"IZQUIERDA UNIDA, INICIATIVA PER CATALUNYA VERDS, ESQUERRA UNIDA I ALTERNATIVA, ANOVA-IRMANDADE NACIONALISTA, ESPAZO ECOSOCIALISTA GALEGO, BATZARRE-ASAMBLEA DE IZQUIERDAS, FEDERACION LOS VERDES, OPCIÓ VERDA-ELS VERDS, GIRA MADRID-LOS VERDES, CONSTRUYENDO LA IZQUIERDA-ALTERNATIVA SOCIALISTA, EZKERREKO EKIMENA-ETORKIZUNA IRATZARRI: LA IZQUIERDA PLURAL",IZQUIERDA PLURAL,False
1279,22,Eberhard, Eberhard Grosske Fiol.,11,"IZQUIERDA UNIDA, INICIATIVA PER CATALUNYA VERDS, ESQUERRA UNIDA I ALTERNATIVA, ANOVA-IRMANDADE NACIONALISTA, ESPAZO ECOSOCIALISTA GALEGO, BATZARRE-ASAMBLEA DE IZQUIERDAS, FEDERACION LOS VERDES, OPCIÓ VERDA-ELS VERDS, GIRA MADRID-LOS VERDES, CONSTRUYENDO LA IZQUIERDA-ALTERNATIVA SOCIALISTA, EZKERREKO EKIMENA-ETORKIZUNA IRATZARRI: LA IZQUIERDA PLURAL",IZQUIERDA PLURAL,False
1280,22,Joan, Joan Francesc Peris García (Federación Los Verdes).,12,"IZQUIERDA UNIDA, INICIATIVA PER CATALUNYA VERDS, ESQUERRA UNIDA I ALTERNATIVA, ANOVA-IRMANDADE NACIONALISTA, ESPAZO ECOSOCIALISTA GALEGO, BATZARRE-ASAMBLEA DE IZQUIERDAS, FEDERACION LOS VERDES, OPCIÓ VERDA-ELS VERDS, GIRA MADRID-LOS VERDES, CONSTRUYENDO LA IZQUIERDA-ALTERNATIVA SOCIALISTA, EZKERREKO EKIMENA-ETORKIZUNA IRATZARRI: LA IZQUIERDA PLURAL",IZQUIERDA PLURAL,False
1281,22,Francisco, Francisco Iturbe Gracia (Independiente).,13,"IZQUIERDA UNIDA, INICIATIVA PER CATALUNYA VERDS, ESQUERRA UNIDA I ALTERNATIVA, ANOVA-IRMANDADE NACIONALISTA, ESPAZO ECOSOCIALISTA GALEGO, BATZARRE-ASAMBLEA DE IZQUIERDAS, FEDERACION LOS VERDES, OPCIÓ VERDA-ELS VERDS, GIRA MADRID-LOS VERDES, CONSTRUYENDO LA IZQUIERDA-ALTERNATIVA SOCIALISTA, EZKERREKO EKIMENA-ETORKIZUNA IRATZARRI: LA IZQUIERDA PLURAL",IZQUIERDA PLURAL,False
1282,22,Maria, Maria Piedad Castillo Martínez.,14,"IZQUIERDA UNIDA, INICIATIVA PER CATALUNYA VERDS, ESQUERRA UNIDA I ALTERNATIVA, ANOVA-IRMANDADE NACIONALISTA, ESPAZO ECOSOCIALISTA GALEGO, BATZARRE-ASAMBLEA DE IZQUIERDAS, FEDERACION LOS VERDES, OPCIÓ VERDA-ELS VERDS, GIRA MADRID-LOS VERDES, CONSTRUYENDO LA IZQUIERDA-ALTERNATIVA SOCIALISTA, EZKERREKO EKIMENA-ETORKIZUNA IRATZARRI: LA IZQUIERDA PLURAL",IZQUIERDA PLURAL,False
1283,22,Maria, Maria Teresa Mola Sainz.,15,"IZQUIERDA UNIDA, INICIATIVA PER CATALUNYA VERDS, ESQUERRA UNIDA I ALTERNATIVA, ANOVA-IRMANDADE NACIONALISTA, ESPAZO ECOSOCIALISTA GALEGO, BATZARRE-ASAMBLEA DE IZQUIERDAS, FEDERACION LOS VERDES, OPCIÓ VERDA-ELS VERDS, GIRA MADRID-LOS VERDES, CONSTRUYENDO LA IZQUIERDA-ALTERNATIVA SOCIALISTA, EZKERREKO EKIMENA-ETORKIZUNA IRATZARRI: LA IZQUIERDA PLURAL",IZQUIERDA PLURAL,False
1284,22,Carlos, Carlos María Asunción Martínez García (ALTERNATIVA SOCIALISTA).,16,"IZQUIERDA UNIDA, INICIATIVA PER CATALUNYA VERDS, ESQUERRA UNIDA I ALTERNATIVA, ANOVA-IRMANDADE NACIONALISTA, ESPAZO ECOSOCIALISTA GALEGO, BATZARRE-ASAMBLEA DE IZQUIERDAS, FEDERACION LOS VERDES, OPCIÓ VERDA-ELS VERDS, GIRA MADRID-LOS VERDES, CONSTRUYENDO LA IZQUIERDA-ALTERNATIVA SOCIALISTA, EZKERREKO EKIMENA-ETORKIZUNA IRATZARRI: LA IZQUIERDA PLURAL",IZQUIERDA PLURAL,False
1285,22,Elvira, Elvira Isabel Hernández Toledo.,17,"IZQUIERDA UNIDA, INICIATIVA PER CATALUNYA VERDS, ESQUERRA UNIDA I ALTERNATIVA, ANOVA-IRMANDADE NACIONALISTA, ESPAZO ECOSOCIALISTA GALEGO, BATZARRE-ASAMBLEA DE IZQUIERDAS, FEDERACION LOS VERDES, OPCIÓ VERDA-ELS VERDS, GIRA MADRID-LOS VERDES, CONSTRUYENDO LA IZQUIERDA-ALTERNATIVA SOCIALISTA, EZKERREKO EKIMENA-ETORKIZUNA IRATZARRI: LA IZQUIERDA PLURAL",IZQUIERDA PLURAL,False
1286,22,Pedro, Pedro Chaves Giraldos.,18,"IZQUIERDA UNIDA, INICIATIVA PER CATALUNYA VERDS, ESQUERRA UNIDA I ALTERNATIVA, ANOVA-IRMANDADE NACIONALISTA, ESPAZO ECOSOCIALISTA GALEGO, BATZARRE-ASAMBLEA DE IZQUIERDAS, FEDERACION LOS VERDES, OPCIÓ VERDA-ELS VERDS, GIRA MADRID-LOS VERDES, CONSTRUYENDO LA IZQUIERDA-ALTERNATIVA SOCIALISTA, EZKERREKO EKIMENA-ETORKIZUNA IRATZARRI: LA IZQUIERDA PLURAL",IZQUIERDA PLURAL,False
1287,22,Jose, Jose María Ortega González.,19,"IZQUIERDA UNIDA, INICIATIVA PER CATALUNYA VERDS, ESQUERRA UNIDA I ALTERNATIVA, ANOVA-IRMANDADE NACIONALISTA, ESPAZO ECOSOCIALISTA GALEGO, BATZARRE-ASAMBLEA DE IZQUIERDAS, FEDERACION LOS VERDES, OPCIÓ VERDA-ELS VERDS, GIRA MADRID-LOS VERDES, CONSTRUYENDO LA IZQUIERDA-ALTERNATIVA SOCIALISTA, EZKERREKO EKIMENA-ETORKIZUNA IRATZARRI: LA IZQUIERDA PLURAL",IZQUIERDA PLURAL,False
1288,22,Adoracion, Adoración Reyes Guamán Hernández.,20,"IZQUIERDA UNIDA, INICIATIVA PER CATALUNYA VERDS, ESQUERRA UNIDA I ALTERNATIVA, ANOVA-IRMANDADE NACIONALISTA, ESPAZO ECOSOCIALISTA GALEGO, BATZARRE-ASAMBLEA DE IZQUIERDAS, FEDERACION LOS VERDES, OPCIÓ VERDA-ELS VERDS, GIRA MADRID-LOS VERDES, CONSTRUYENDO LA IZQUIERDA-ALTERNATIVA SOCIALISTA, EZKERREKO EKIMENA-ETORKIZUNA IRATZARRI: LA IZQUIERDA PLURAL",IZQUIERDA PLURAL,False
1289,22,Jose, José Alejandro Ávila Sánchez.,21,"IZQUIERDA UNIDA, INICIATIVA PER CATALUNYA VERDS, ESQUERRA UNIDA I ALTERNATIVA, ANOVA-IRMANDADE NACIONALISTA, ESPAZO ECOSOCIALISTA GALEGO, BATZARRE-ASAMBLEA DE IZQUIERDAS, FEDERACION LOS VERDES, OPCIÓ VERDA-ELS VERDS, GIRA MADRID-LOS VERDES, CONSTRUYENDO LA IZQUIERDA-ALTERNATIVA SOCIALISTA, EZKERREKO EKIMENA-ETORKIZUNA IRATZARRI: LA IZQUIERDA PLURAL",IZQUIERDA PLURAL,False
1290,22,Inigo, Iñigo Martínez Zatón.,22,"IZQUIERDA UNIDA, INICIATIVA PER CATALUNYA VERDS, ESQUERRA UNIDA I ALTERNATIVA, ANOVA-IRMANDADE NACIONALISTA, ESPAZO ECOSOCIALISTA GALEGO, BATZARRE-ASAMBLEA DE IZQUIERDAS, FEDERACION LOS VERDES, OPCIÓ VERDA-ELS VERDS, GIRA MADRID-LOS VERDES, CONSTRUYENDO LA IZQUIERDA-ALTERNATIVA SOCIALISTA, EZKERREKO EKIMENA-ETORKIZUNA IRATZARRI: LA IZQUIERDA PLURAL",IZQUIERDA PLURAL,False
1291,22,Mar, Mar Cambrollé Jurado (Independiente).,23,"IZQUIERDA UNIDA, INICIATIVA PER CATALUNYA VERDS, ESQUERRA UNIDA I ALTERNATIVA, ANOVA-IRMANDADE NACIONALISTA, ESPAZO ECOSOCIALISTA GALEGO, BATZARRE-ASAMBLEA DE IZQUIERDAS, FEDERACION LOS VERDES, OPCIÓ VERDA-ELS VERDS, GIRA MADRID-LOS VERDES, CONSTRUYENDO LA IZQUIERDA-ALTERNATIVA SOCIALISTA, EZKERREKO EKIMENA-ETORKIZUNA IRATZARRI: LA IZQUIERDA PLURAL",IZQUIERDA PLURAL,False
1292,22,Jose, José Miguel de Sebastián Carrero.,24,"IZQUIERDA UNIDA, INICIATIVA PER CATALUNYA VERDS, ESQUERRA UNIDA I ALTERNATIVA, ANOVA-IRMANDADE NACIONALISTA, ESPAZO ECOSOCIALISTA GALEGO, BATZARRE-ASAMBLEA DE IZQUIERDAS, FEDERACION LOS VERDES, OPCIÓ VERDA-ELS VERDS, GIRA MADRID-LOS VERDES, CONSTRUYENDO LA IZQUIERDA-ALTERNATIVA SOCIALISTA, EZKERREKO EKIMENA-ETORKIZUNA IRATZARRI: LA IZQUIERDA PLURAL",IZQUIERDA PLURAL,False
1293,22,Isabel, Isabel Crespo Ruíz.,25,"IZQUIERDA UNIDA, INICIATIVA PER CATALUNYA VERDS, ESQUERRA UNIDA I ALTERNATIVA, ANOVA-IRMANDADE NACIONALISTA, ESPAZO ECOSOCIALISTA GALEGO, BATZARRE-ASAMBLEA DE IZQUIERDAS, FEDERACION LOS VERDES, OPCIÓ VERDA-ELS VERDS, GIRA MADRID-LOS VERDES, CONSTRUYENDO LA IZQUIERDA-ALTERNATIVA SOCIALISTA, EZKERREKO EKIMENA-ETORKIZUNA IRATZARRI: LA IZQUIERDA PLURAL",IZQUIERDA PLURAL,False
1294,22,Maria, María Milagros Rubio Salvatierra (BATZARRE).,26,"IZQUIERDA UNIDA, INICIATIVA PER CATALUNYA VERDS, ESQUERRA UNIDA I ALTERNATIVA, ANOVA-IRMANDADE NACIONALISTA, ESPAZO ECOSOCIALISTA GALEGO, BATZARRE-ASAMBLEA DE IZQUIERDAS, FEDERACION LOS VERDES, OPCIÓ VERDA-ELS VERDS, GIRA MADRID-LOS VERDES, CONSTRUYENDO LA IZQUIERDA-ALTERNATIVA SOCIALISTA, EZKERREKO EKIMENA-ETORKIZUNA IRATZARRI: LA IZQUIERDA PLURAL",IZQUIERDA PLURAL,False
1295,22,Carmen, Carmen Duce Díaz.,27,"IZQUIERDA UNIDA, INICIATIVA PER CATALUNYA VERDS, ESQUERRA UNIDA I ALTERNATIVA, ANOVA-IRMANDADE NACIONALISTA, ESPAZO ECOSOCIALISTA GALEGO, BATZARRE-ASAMBLEA DE IZQUIERDAS, FEDERACION LOS VERDES, OPCIÓ VERDA-ELS VERDS, GIRA MADRID-LOS VERDES, CONSTRUYENDO LA IZQUIERDA-ALTERNATIVA SOCIALISTA, EZKERREKO EKIMENA-ETORKIZUNA IRATZARRI: LA IZQUIERDA PLURAL",IZQUIERDA PLURAL,False
1296,22,Martin, Martín Dámaso Alfonso Polo.,28,"IZQUIERDA UNIDA, INICIATIVA PER CATALUNYA VERDS, ESQUERRA UNIDA I ALTERNATIVA, ANOVA-IRMANDADE NACIONALISTA, ESPAZO ECOSOCIALISTA GALEGO, BATZARRE-ASAMBLEA DE IZQUIERDAS, FEDERACION LOS VERDES, OPCIÓ VERDA-ELS VERDS, GIRA MADRID-LOS VERDES, CONSTRUYENDO LA IZQUIERDA-ALTERNATIVA SOCIALISTA, EZKERREKO EKIMENA-ETORKIZUNA IRATZARRI: LA IZQUIERDA PLURAL",IZQUIERDA PLURAL,False
1297,22,Montserrat, Montserrat Gemma Castellà Espuny (ICV).,29,"IZQUIERDA UNIDA, INICIATIVA PER CATALUNYA VERDS, ESQUERRA UNIDA I ALTERNATIVA, ANOVA-IRMANDADE NACIONALISTA, ESPAZO ECOSOCIALISTA GALEGO, BATZARRE-ASAMBLEA DE IZQUIERDAS, FEDERACION LOS VERDES, OPCIÓ VERDA-ELS VERDS, GIRA MADRID-LOS VERDES, CONSTRUYENDO LA IZQUIERDA-ALTERNATIVA SOCIALISTA, EZKERREKO EKIMENA-ETORKIZUNA IRATZARRI: LA IZQUIERDA PLURAL",IZQUIERDA PLURAL,False
1298,22,Jose, José Luis Outes Ruso.,30,"IZQUIERDA UNIDA, INICIATIVA PER CATALUNYA VERDS, ESQUERRA UNIDA I ALTERNATIVA, ANOVA-IRMANDADE NACIONALISTA, ESPAZO ECOSOCIALISTA GALEGO, BATZARRE-ASAMBLEA DE IZQUIERDAS, FEDERACION LOS VERDES, OPCIÓ VERDA-ELS VERDS, GIRA MADRID-LOS VERDES, CONSTRUYENDO LA IZQUIERDA-ALTERNATIVA SOCIALISTA, EZKERREKO EKIMENA-ETORKIZUNA IRATZARRI: LA IZQUIERDA PLURAL",IZQUIERDA PLURAL,False
1299,22,Joana, Joana Agudo Bataller (ICV).,31,"IZQUIERDA UNIDA, INICIATIVA PER CATALUNYA VERDS, ESQUERRA UNIDA I ALTERNATIVA, ANOVA-IRMANDADE NACIONALISTA, ESPAZO ECOSOCIALISTA GALEGO, BATZARRE-ASAMBLEA DE IZQUIERDAS, FEDERACION LOS VERDES, OPCIÓ VERDA-ELS VERDS, GIRA MADRID-LOS VERDES, CONSTRUYENDO LA IZQUIERDA-ALTERNATIVA SOCIALISTA, EZKERREKO EKIMENA-ETORKIZUNA IRATZARRI: LA IZQUIERDA PLURAL",IZQUIERDA PLURAL,False
1300,22,Andres, Andrés Barrio Ramírez.,32,"IZQUIERDA UNIDA, INICIATIVA PER CATALUNYA VERDS, ESQUERRA UNIDA I ALTERNATIVA, ANOVA-IRMANDADE NACIONALISTA, ESPAZO ECOSOCIALISTA GALEGO, BATZARRE-ASAMBLEA DE IZQUIERDAS, FEDERACION LOS VERDES, OPCIÓ VERDA-ELS VERDS, GIRA MADRID-LOS VERDES, CONSTRUYENDO LA IZQUIERDA-ALTERNATIVA SOCIALISTA, EZKERREKO EKIMENA-ETORKIZUNA IRATZARRI: LA IZQUIERDA PLURAL",IZQUIERDA PLURAL,False
1301,22,Marta, Marta Ávila León (Independiente).,33,"IZQUIERDA UNIDA, INICIATIVA PER CATALUNYA VERDS, ESQUERRA UNIDA I ALTERNATIVA, ANOVA-IRMANDADE NACIONALISTA, ESPAZO ECOSOCIALISTA GALEGO, BATZARRE-ASAMBLEA DE IZQUIERDAS, FEDERACION LOS VERDES, OPCIÓ VERDA-ELS VERDS, GIRA MADRID-LOS VERDES, CONSTRUYENDO LA IZQUIERDA-ALTERNATIVA SOCIALISTA, EZKERREKO EKIMENA-ETORKIZUNA IRATZARRI: LA IZQUIERDA PLURAL",IZQUIERDA PLURAL,False
1302,22,Honorio, Honorio Antonio Cardoso García.,34,"IZQUIERDA UNIDA, INICIATIVA PER CATALUNYA VERDS, ESQUERRA UNIDA I ALTERNATIVA, ANOVA-IRMANDADE NACIONALISTA, ESPAZO ECOSOCIALISTA GALEGO, BATZARRE-ASAMBLEA DE IZQUIERDAS, FEDERACION LOS VERDES, OPCIÓ VERDA-ELS VERDS, GIRA MADRID-LOS VERDES, CONSTRUYENDO LA IZQUIERDA-ALTERNATIVA SOCIALISTA, EZKERREKO EKIMENA-ETORKIZUNA IRATZARRI: LA IZQUIERDA PLURAL",IZQUIERDA PLURAL,False
1303,22,Carlos, Carlos Lorenzo Lorenzo Simon (ANOVA).,35,"IZQUIERDA UNIDA, INICIATIVA PER CATALUNYA VERDS, ESQUERRA UNIDA I ALTERNATIVA, ANOVA-IRMANDADE NACIONALISTA, ESPAZO ECOSOCIALISTA GALEGO, BATZARRE-ASAMBLEA DE IZQUIERDAS, FEDERACION LOS VERDES, OPCIÓ VERDA-ELS VERDS, GIRA MADRID-LOS VERDES, CONSTRUYENDO LA IZQUIERDA-ALTERNATIVA SOCIALISTA, EZKERREKO EKIMENA-ETORKIZUNA IRATZARRI: LA IZQUIERDA PLURAL",IZQUIERDA PLURAL,False
1304,22,Ana, Ana Cruz Muñoz.,36,"IZQUIERDA UNIDA, INICIATIVA PER CATALUNYA VERDS, ESQUERRA UNIDA I ALTERNATIVA, ANOVA-IRMANDADE NACIONALISTA, ESPAZO ECOSOCIALISTA GALEGO, BATZARRE-ASAMBLEA DE IZQUIERDAS, FEDERACION LOS VERDES, OPCIÓ VERDA-ELS VERDS, GIRA MADRID-LOS VERDES, CONSTRUYENDO LA IZQUIERDA-ALTERNATIVA SOCIALISTA, EZKERREKO EKIMENA-ETORKIZUNA IRATZARRI: LA IZQUIERDA PLURAL",IZQUIERDA PLURAL,False
1305,22,Maria, María Delfina Rossi Silvano (ICV).,37,"IZQUIERDA UNIDA, INICIATIVA PER CATALUNYA VERDS, ESQUERRA UNIDA I ALTERNATIVA, ANOVA-IRMANDADE NACIONALISTA, ESPAZO ECOSOCIALISTA GALEGO, BATZARRE-ASAMBLEA DE IZQUIERDAS, FEDERACION LOS VERDES, OPCIÓ VERDA-ELS VERDS, GIRA MADRID-LOS VERDES, CONSTRUYENDO LA IZQUIERDA-ALTERNATIVA SOCIALISTA, EZKERREKO EKIMENA-ETORKIZUNA IRATZARRI: LA IZQUIERDA PLURAL",IZQUIERDA PLURAL,False
1306,22,Maria, María Huertas Marín Ibarra.,38,"IZQUIERDA UNIDA, INICIATIVA PER CATALUNYA VERDS, ESQUERRA UNIDA I ALTERNATIVA, ANOVA-IRMANDADE NACIONALISTA, ESPAZO ECOSOCIALISTA GALEGO, BATZARRE-ASAMBLEA DE IZQUIERDAS, FEDERACION LOS VERDES, OPCIÓ VERDA-ELS VERDS, GIRA MADRID-LOS VERDES, CONSTRUYENDO LA IZQUIERDA-ALTERNATIVA SOCIALISTA, EZKERREKO EKIMENA-ETORKIZUNA IRATZARRI: LA IZQUIERDA PLURAL",IZQUIERDA PLURAL,False
1307,22,Javier, Javier Suárez Llana.,39,"IZQUIERDA UNIDA, INICIATIVA PER CATALUNYA VERDS, ESQUERRA UNIDA I ALTERNATIVA, ANOVA-IRMANDADE NACIONALISTA, ESPAZO ECOSOCIALISTA GALEGO, BATZARRE-ASAMBLEA DE IZQUIERDAS, FEDERACION LOS VERDES, OPCIÓ VERDA-ELS VERDS, GIRA MADRID-LOS VERDES, CONSTRUYENDO LA IZQUIERDA-ALTERNATIVA SOCIALISTA, EZKERREKO EKIMENA-ETORKIZUNA IRATZARRI: LA IZQUIERDA PLURAL",IZQUIERDA PLURAL,False
1308,22,Francisco, Francisco Javier Sáez del Álamo.,40,"IZQUIERDA UNIDA, INICIATIVA PER CATALUNYA VERDS, ESQUERRA UNIDA I ALTERNATIVA, ANOVA-IRMANDADE NACIONALISTA, ESPAZO ECOSOCIALISTA GALEGO, BATZARRE-ASAMBLEA DE IZQUIERDAS, FEDERACION LOS VERDES, OPCIÓ VERDA-ELS VERDS, GIRA MADRID-LOS VERDES, CONSTRUYENDO LA IZQUIERDA-ALTERNATIVA SOCIALISTA, EZKERREKO EKIMENA-ETORKIZUNA IRATZARRI: LA IZQUIERDA PLURAL",IZQUIERDA PLURAL,False
1309,22,Maria, María Isabel Alcázar Franco.,41,"IZQUIERDA UNIDA, INICIATIVA PER CATALUNYA VERDS, ESQUERRA UNIDA I ALTERNATIVA, ANOVA-IRMANDADE NACIONALISTA, ESPAZO ECOSOCIALISTA GALEGO, BATZARRE-ASAMBLEA DE IZQUIERDAS, FEDERACION LOS VERDES, OPCIÓ VERDA-ELS VERDS, GIRA MADRID-LOS VERDES, CONSTRUYENDO LA IZQUIERDA-ALTERNATIVA SOCIALISTA, EZKERREKO EKIMENA-ETORKIZUNA IRATZARRI: LA IZQUIERDA PLURAL",IZQUIERDA PLURAL,False
1310,22,Eugenia, Eugènia Pascual Puig (ICV).,42,"IZQUIERDA UNIDA, INICIATIVA PER CATALUNYA VERDS, ESQUERRA UNIDA I ALTERNATIVA, ANOVA-IRMANDADE NACIONALISTA, ESPAZO ECOSOCIALISTA GALEGO, BATZARRE-ASAMBLEA DE IZQUIERDAS, FEDERACION LOS VERDES, OPCIÓ VERDA-ELS VERDS, GIRA MADRID-LOS VERDES, CONSTRUYENDO LA IZQUIERDA-ALTERNATIVA SOCIALISTA, EZKERREKO EKIMENA-ETORKIZUNA IRATZARRI: LA IZQUIERDA PLURAL",IZQUIERDA PLURAL,False
1311,22,Alberto, Alberto Cubero Serrano.,43,"IZQUIERDA UNIDA, INICIATIVA PER CATALUNYA VERDS, ESQUERRA UNIDA I ALTERNATIVA, ANOVA-IRMANDADE NACIONALISTA, ESPAZO ECOSOCIALISTA GALEGO, BATZARRE-ASAMBLEA DE IZQUIERDAS, FEDERACION LOS VERDES, OPCIÓ VERDA-ELS VERDS, GIRA MADRID-LOS VERDES, CONSTRUYENDO LA IZQUIERDA-ALTERNATIVA SOCIALISTA, EZKERREKO EKIMENA-ETORKIZUNA IRATZARRI: LA IZQUIERDA PLURAL",IZQUIERDA PLURAL,False
1312,22,Jaime, Jaime Puig Casasayas (Independiente).,44,"IZQUIERDA UNIDA, INICIATIVA PER CATALUNYA VERDS, ESQUERRA UNIDA I ALTERNATIVA, ANOVA-IRMANDADE NACIONALISTA, ESPAZO ECOSOCIALISTA GALEGO, BATZARRE-ASAMBLEA DE IZQUIERDAS, FEDERACION LOS VERDES, OPCIÓ VERDA-ELS VERDS, GIRA MADRID-LOS VERDES, CONSTRUYENDO LA IZQUIERDA-ALTERNATIVA SOCIALISTA, EZKERREKO EKIMENA-ETORKIZUNA IRATZARRI: LA IZQUIERDA PLURAL",IZQUIERDA PLURAL,False
1313,22,Sainza, Sainza Ruiz Ferreño.,45,"IZQUIERDA UNIDA, INICIATIVA PER CATALUNYA VERDS, ESQUERRA UNIDA I ALTERNATIVA, ANOVA-IRMANDADE NACIONALISTA, ESPAZO ECOSOCIALISTA GALEGO, BATZARRE-ASAMBLEA DE IZQUIERDAS, FEDERACION LOS VERDES, OPCIÓ VERDA-ELS VERDS, GIRA MADRID-LOS VERDES, CONSTRUYENDO LA IZQUIERDA-ALTERNATIVA SOCIALISTA, EZKERREKO EKIMENA-ETORKIZUNA IRATZARRI: LA IZQUIERDA PLURAL",IZQUIERDA PLURAL,False
1314,22,Maria, Maria Libertad González Benavides.,46,"IZQUIERDA UNIDA, INICIATIVA PER CATALUNYA VERDS, ESQUERRA UNIDA I ALTERNATIVA, ANOVA-IRMANDADE NACIONALISTA, ESPAZO ECOSOCIALISTA GALEGO, BATZARRE-ASAMBLEA DE IZQUIERDAS, FEDERACION LOS VERDES, OPCIÓ VERDA-ELS VERDS, GIRA MADRID-LOS VERDES, CONSTRUYENDO LA IZQUIERDA-ALTERNATIVA SOCIALISTA, EZKERREKO EKIMENA-ETORKIZUNA IRATZARRI: LA IZQUIERDA PLURAL",IZQUIERDA PLURAL,False
1315,22,Leire, Leire Martínez Hierro (EKI).,47,"IZQUIERDA UNIDA, INICIATIVA PER CATALUNYA VERDS, ESQUERRA UNIDA I ALTERNATIVA, ANOVA-IRMANDADE NACIONALISTA, ESPAZO ECOSOCIALISTA GALEGO, BATZARRE-ASAMBLEA DE IZQUIERDAS, FEDERACION LOS VERDES, OPCIÓ VERDA-ELS VERDS, GIRA MADRID-LOS VERDES, CONSTRUYENDO LA IZQUIERDA-ALTERNATIVA SOCIALISTA, EZKERREKO EKIMENA-ETORKIZUNA IRATZARRI: LA IZQUIERDA PLURAL",IZQUIERDA PLURAL,False
1316,22,Jose, José Javier Barinaga Adrián.,48,"IZQUIERDA UNIDA, INICIATIVA PER CATALUNYA VERDS, ESQUERRA UNIDA I ALTERNATIVA, ANOVA-IRMANDADE NACIONALISTA, ESPAZO ECOSOCIALISTA GALEGO, BATZARRE-ASAMBLEA DE IZQUIERDAS, FEDERACION LOS VERDES, OPCIÓ VERDA-ELS VERDS, GIRA MADRID-LOS VERDES, CONSTRUYENDO LA IZQUIERDA-ALTERNATIVA SOCIALISTA, EZKERREKO EKIMENA-ETORKIZUNA IRATZARRI: LA IZQUIERDA PLURAL",IZQUIERDA PLURAL,False
1317,22,Asensio, Asensio García Machi.,49,"IZQUIERDA UNIDA, INICIATIVA PER CATALUNYA VERDS, ESQUERRA UNIDA I ALTERNATIVA, ANOVA-IRMANDADE NACIONALISTA, ESPAZO ECOSOCIALISTA GALEGO, BATZARRE-ASAMBLEA DE IZQUIERDAS, FEDERACION LOS VERDES, OPCIÓ VERDA-ELS VERDS, GIRA MADRID-LOS VERDES, CONSTRUYENDO LA IZQUIERDA-ALTERNATIVA SOCIALISTA, EZKERREKO EKIMENA-ETORKIZUNA IRATZARRI: LA IZQUIERDA PLURAL",IZQUIERDA PLURAL,False
1318,22,Isabel, Isabel Saavedra Domenech.,50,"IZQUIERDA UNIDA, INICIATIVA PER CATALUNYA VERDS, ESQUERRA UNIDA I ALTERNATIVA, ANOVA-IRMANDADE NACIONALISTA, ESPAZO ECOSOCIALISTA GALEGO, BATZARRE-ASAMBLEA DE IZQUIERDAS, FEDERACION LOS VERDES, OPCIÓ VERDA-ELS VERDS, GIRA MADRID-LOS VERDES, CONSTRUYENDO LA IZQUIERDA-ALTERNATIVA SOCIALISTA, EZKERREKO EKIMENA-ETORKIZUNA IRATZARRI: LA IZQUIERDA PLURAL",IZQUIERDA PLURAL,False
1319,22,Josefa, Josefa Bueno García.,51,"IZQUIERDA UNIDA, INICIATIVA PER CATALUNYA VERDS, ESQUERRA UNIDA I ALTERNATIVA, ANOVA-IRMANDADE NACIONALISTA, ESPAZO ECOSOCIALISTA GALEGO, BATZARRE-ASAMBLEA DE IZQUIERDAS, FEDERACION LOS VERDES, OPCIÓ VERDA-ELS VERDS, GIRA MADRID-LOS VERDES, CONSTRUYENDO LA IZQUIERDA-ALTERNATIVA SOCIALISTA, EZKERREKO EKIMENA-ETORKIZUNA IRATZARRI: LA IZQUIERDA PLURAL",IZQUIERDA PLURAL,False
1320,22,Juan, Juan Martínez García (Espazo).,52,"IZQUIERDA UNIDA, INICIATIVA PER CATALUNYA VERDS, ESQUERRA UNIDA I ALTERNATIVA, ANOVA-IRMANDADE NACIONALISTA, ESPAZO ECOSOCIALISTA GALEGO, BATZARRE-ASAMBLEA DE IZQUIERDAS, FEDERACION LOS VERDES, OPCIÓ VERDA-ELS VERDS, GIRA MADRID-LOS VERDES, CONSTRUYENDO LA IZQUIERDA-ALTERNATIVA SOCIALISTA, EZKERREKO EKIMENA-ETORKIZUNA IRATZARRI: LA IZQUIERDA PLURAL",IZQUIERDA PLURAL,False
1321,22,Maria, María Carmen Rodríguez Guerra (Independiente).,53,"IZQUIERDA UNIDA, INICIATIVA PER CATALUNYA VERDS, ESQUERRA UNIDA I ALTERNATIVA, ANOVA-IRMANDADE NACIONALISTA, ESPAZO ECOSOCIALISTA GALEGO, BATZARRE-ASAMBLEA DE IZQUIERDAS, FEDERACION LOS VERDES, OPCIÓ VERDA-ELS VERDS, GIRA MADRID-LOS VERDES, CONSTRUYENDO LA IZQUIERDA-ALTERNATIVA SOCIALISTA, EZKERREKO EKIMENA-ETORKIZUNA IRATZARRI: LA IZQUIERDA PLURAL",IZQUIERDA PLURAL,False
1322,22,Antonio, Antonio Barbarà Molina (EUiA).,54,"IZQUIERDA UNIDA, INICIATIVA PER CATALUNYA VERDS, ESQUERRA UNIDA I ALTERNATIVA, ANOVA-IRMANDADE NACIONALISTA, ESPAZO ECOSOCIALISTA GALEGO, BATZARRE-ASAMBLEA DE IZQUIERDAS, FEDERACION LOS VERDES, OPCIÓ VERDA-ELS VERDS, GIRA MADRID-LOS VERDES, CONSTRUYENDO LA IZQUIERDA-ALTERNATIVA SOCIALISTA, EZKERREKO EKIMENA-ETORKIZUNA IRATZARRI: LA IZQUIERDA PLURAL",IZQUIERDA PLURAL,False
1323,22,Granada, Granada Santos García.,1,"IZQUIERDA UNIDA, INICIATIVA PER CATALUNYA VERDS, ESQUERRA UNIDA I ALTERNATIVA, ANOVA-IRMANDADE NACIONALISTA, ESPAZO ECOSOCIALISTA GALEGO, BATZARRE-ASAMBLEA DE IZQUIERDAS, FEDERACION LOS VERDES, OPCIÓ VERDA-ELS VERDS, GIRA MADRID-LOS VERDES, CONSTRUYENDO LA IZQUIERDA-ALTERNATIVA SOCIALISTA, EZKERREKO EKIMENA-ETORKIZUNA IRATZARRI: LA IZQUIERDA PLURAL",IZQUIERDA PLURAL,True
1324,22,Carles, Carles Feixa Pámpols (ICV).,2,"IZQUIERDA UNIDA, INICIATIVA PER CATALUNYA VERDS, ESQUERRA UNIDA I ALTERNATIVA, ANOVA-IRMANDADE NACIONALISTA, ESPAZO ECOSOCIALISTA GALEGO, BATZARRE-ASAMBLEA DE IZQUIERDAS, FEDERACION LOS VERDES, OPCIÓ VERDA-ELS VERDS, GIRA MADRID-LOS VERDES, CONSTRUYENDO LA IZQUIERDA-ALTERNATIVA SOCIALISTA, EZKERREKO EKIMENA-ETORKIZUNA IRATZARRI: LA IZQUIERDA PLURAL",IZQUIERDA PLURAL,True
1325,22,Beatriz, Beatriz Izuel Montañés.,3,"IZQUIERDA UNIDA, INICIATIVA PER CATALUNYA VERDS, ESQUERRA UNIDA I ALTERNATIVA, ANOVA-IRMANDADE NACIONALISTA, ESPAZO ECOSOCIALISTA GALEGO, BATZARRE-ASAMBLEA DE IZQUIERDAS, FEDERACION LOS VERDES, OPCIÓ VERDA-ELS VERDS, GIRA MADRID-LOS VERDES, CONSTRUYENDO LA IZQUIERDA-ALTERNATIVA SOCIALISTA, EZKERREKO EKIMENA-ETORKIZUNA IRATZARRI: LA IZQUIERDA PLURAL",IZQUIERDA PLURAL,True
1326,22,Juan, Juan Manuel García Arcos (Independiente).,4,"IZQUIERDA UNIDA, INICIATIVA PER CATALUNYA VERDS, ESQUERRA UNIDA I ALTERNATIVA, ANOVA-IRMANDADE NACIONALISTA, ESPAZO ECOSOCIALISTA GALEGO, BATZARRE-ASAMBLEA DE IZQUIERDAS, FEDERACION LOS VERDES, OPCIÓ VERDA-ELS VERDS, GIRA MADRID-LOS VERDES, CONSTRUYENDO LA IZQUIERDA-ALTERNATIVA SOCIALISTA, EZKERREKO EKIMENA-ETORKIZUNA IRATZARRI: LA IZQUIERDA PLURAL",IZQUIERDA PLURAL,True
1327,22,Oscar, Óscar Evaristo Rodríguez Aller.,5,"IZQUIERDA UNIDA, INICIATIVA PER CATALUNYA VERDS, ESQUERRA UNIDA I ALTERNATIVA, ANOVA-IRMANDADE NACIONALISTA, ESPAZO ECOSOCIALISTA GALEGO, BATZARRE-ASAMBLEA DE IZQUIERDAS, FEDERACION LOS VERDES, OPCIÓ VERDA-ELS VERDS, GIRA MADRID-LOS VERDES, CONSTRUYENDO LA IZQUIERDA-ALTERNATIVA SOCIALISTA, EZKERREKO EKIMENA-ETORKIZUNA IRATZARRI: LA IZQUIERDA PLURAL",IZQUIERDA PLURAL,True
1328,22,Joaquin, Joaquín Antonio Paredes Diéguez.,6,"IZQUIERDA UNIDA, INICIATIVA PER CATALUNYA VERDS, ESQUERRA UNIDA I ALTERNATIVA, ANOVA-IRMANDADE NACIONALISTA, ESPAZO ECOSOCIALISTA GALEGO, BATZARRE-ASAMBLEA DE IZQUIERDAS, FEDERACION LOS VERDES, OPCIÓ VERDA-ELS VERDS, GIRA MADRID-LOS VERDES, CONSTRUYENDO LA IZQUIERDA-ALTERNATIVA SOCIALISTA, EZKERREKO EKIMENA-ETORKIZUNA IRATZARRI: LA IZQUIERDA PLURAL",IZQUIERDA PLURAL,True
1329,22,Maria, María Cristina Simó Alcaraz.,7,"IZQUIERDA UNIDA, INICIATIVA PER CATALUNYA VERDS, ESQUERRA UNIDA I ALTERNATIVA, ANOVA-IRMANDADE NACIONALISTA, ESPAZO ECOSOCIALISTA GALEGO, BATZARRE-ASAMBLEA DE IZQUIERDAS, FEDERACION LOS VERDES, OPCIÓ VERDA-ELS VERDS, GIRA MADRID-LOS VERDES, CONSTRUYENDO LA IZQUIERDA-ALTERNATIVA SOCIALISTA, EZKERREKO EKIMENA-ETORKIZUNA IRATZARRI: LA IZQUIERDA PLURAL",IZQUIERDA PLURAL,True
1330,22,Maria, Maria Luisa Bergaz Conesa.,8,"IZQUIERDA UNIDA, INICIATIVA PER CATALUNYA VERDS, ESQUERRA UNIDA I ALTERNATIVA, ANOVA-IRMANDADE NACIONALISTA, ESPAZO ECOSOCIALISTA GALEGO, BATZARRE-ASAMBLEA DE IZQUIERDAS, FEDERACION LOS VERDES, OPCIÓ VERDA-ELS VERDS, GIRA MADRID-LOS VERDES, CONSTRUYENDO LA IZQUIERDA-ALTERNATIVA SOCIALISTA, EZKERREKO EKIMENA-ETORKIZUNA IRATZARRI: LA IZQUIERDA PLURAL",IZQUIERDA PLURAL,True
1331,22,Alfonso, Alfonso García-Oliva Mascarós.,9,"IZQUIERDA UNIDA, INICIATIVA PER CATALUNYA VERDS, ESQUERRA UNIDA I ALTERNATIVA, ANOVA-IRMANDADE NACIONALISTA, ESPAZO ECOSOCIALISTA GALEGO, BATZARRE-ASAMBLEA DE IZQUIERDAS, FEDERACION LOS VERDES, OPCIÓ VERDA-ELS VERDS, GIRA MADRID-LOS VERDES, CONSTRUYENDO LA IZQUIERDA-ALTERNATIVA SOCIALISTA, EZKERREKO EKIMENA-ETORKIZUNA IRATZARRI: LA IZQUIERDA PLURAL",IZQUIERDA PLURAL,True
1332,22,Maria, María Arenas Lopera.,10,"IZQUIERDA UNIDA, INICIATIVA PER CATALUNYA VERDS, ESQUERRA UNIDA I ALTERNATIVA, ANOVA-IRMANDADE NACIONALISTA, ESPAZO ECOSOCIALISTA GALEGO, BATZARRE-ASAMBLEA DE IZQUIERDAS, FEDERACION LOS VERDES, OPCIÓ VERDA-ELS VERDS, GIRA MADRID-LOS VERDES, CONSTRUYENDO LA IZQUIERDA-ALTERNATIVA SOCIALISTA, EZKERREKO EKIMENA-ETORKIZUNA IRATZARRI: LA IZQUIERDA PLURAL",IZQUIERDA PLURAL,True
1333,23,Iosu, Iosu Mirena Juaristi Abaunz (EH Bildu).,1,LOS PUEBLOS DECIDEN (LPD),LPD,False
1334,23,Ana, Ana Miranda Paz (BNG).,2,LOS PUEBLOS DECIDEN (LPD),LPD,False
1335,23,Lorena, Lorena Lpz. de Lacalle Arizti (EH Bildu).,3,LOS PUEBLOS DECIDEN (LPD),LPD,False
1336,23,Xose, Xosé Manuel Carril Vázquez (BNG).,4,LOS PUEBLOS DECIDEN (LPD),LPD,False
1337,23,Maite, Maite Juliana Iturre Llano (EH Bildu).,5,LOS PUEBLOS DECIDEN (LPD),LPD,False
1338,23,Olalla, Olalla Rodil Fernández (BNG).,6,LOS PUEBLOS DECIDEN (LPD),LPD,False
1339,23,Igor, Igor Navarro Brea (EH Bildu).,7,LOS PUEBLOS DECIDEN (LPD),LPD,False
1340,23,Xesus, Xesús Domínguez Domínguez (BNG).,8,LOS PUEBLOS DECIDEN (LPD),LPD,False
