,candidatura,nombre,nombre_completo,numero,partido,siglas,suplente
0,1,Juana, Juana María Santana Hernández.,1,INICIATIVA FEMINISTA (I.Fem),I.Fem,False
1,1,Consuelo, Consuelo Mira Tornadijo.,2,INICIATIVA FEMINISTA (I.Fem),I.Fem,False
2,1,Maria, María Jesús Rodríguez Cuevas.,3,INICIATIVA FEMINISTA (I.Fem),I.Fem,False
3,1,Javier, Javier Gonzálvez Avellana.,4,INICIATIVA FEMINISTA (I.Fem),I.Fem,False
4,1,Alfonso, Alfonso Francisco Marco Calvo.,5,INICIATIVA FEMINISTA (I.Fem),I.Fem,False
5,1,Ana, Ana María Valverde Sánchez.,6,INICIATIVA FEMINISTA (I.Fem),I.Fem,False
6,1,Marina, Marina Esteban Sastre.,7,INICIATIVA FEMINISTA (I.Fem),I.Fem,False
7,1,Maria, María Antonia Moreno Llaneza.,8,INICIATIVA FEMINISTA (I.Fem),I.Fem,False
8,1,Enric, Enric Royo Rajadell.,9,INICIATIVA FEMINISTA (I.Fem),I.Fem,False
9,1,Francisco, Francisco Modesto Mireles Betancor.,10,INICIATIVA FEMINISTA (I.Fem),I.Fem,False
10,1,Maria, María de los Ángeles Joaquina Munuera Bassols.,11,INICIATIVA FEMINISTA (I.Fem),I.Fem,False
11,1,Maria, María Soledad Mochales López.,12,INICIATIVA FEMINISTA (I.Fem),I.Fem,False
12,1,Maria, María Jesús López Cañete.,13,INICIATIVA FEMINISTA (I.Fem),I.Fem,False
13,1,Jose, José César Antón Pascual.,14,INICIATIVA FEMINISTA (I.Fem),I.Fem,False
14,1,Jose, José Fernández Díaz.,15,INICIATIVA FEMINISTA (I.Fem),I.Fem,False
15,1,Maria, María Pilar Pallás López.,16,INICIATIVA FEMINISTA (I.Fem),I.Fem,False
16,1,Isabel, Isabel Mira Tornadijo.,17,INICIATIVA FEMINISTA (I.Fem),I.Fem,False
17,1,Alicia, Alicia María Bolaños Naranjo.,18,INICIATIVA FEMINISTA (I.Fem),I.Fem,False
18,1,Jaime, Jaime Alfonso Beneyto Gasset.,19,INICIATIVA FEMINISTA (I.Fem),I.Fem,False
19,1,Angel, Ángel Alberto Vega Cancio.,20,INICIATIVA FEMINISTA (I.Fem),I.Fem,False
20,1,Ester, Ester Aurelia Andrés y del Alar.,21,INICIATIVA FEMINISTA (I.Fem),I.Fem,False
21,1,Maria, María Castro Carrascosa.,22,INICIATIVA FEMINISTA (I.Fem),I.Fem,False
22,1,Begona, Begoña Ferreira Vidal.,23,INICIATIVA FEMINISTA (I.Fem),I.Fem,False
23,1,Jesus, Jesús Pedrós Cholvi.,24,INICIATIVA FEMINISTA (I.Fem),I.Fem,False
24,1,Luis, Luis Jacobo Jaume Saura.,25,INICIATIVA FEMINISTA (I.Fem),I.Fem,False
25,1,Maria, María Ángeles Pérez Reyes.,26,INICIATIVA FEMINISTA (I.Fem),I.Fem,False
26,1,Maria, María Rosa Cervera Salinas.,27,INICIATIVA FEMINISTA (I.Fem),I.Fem,False
27,1,Maria, María Teresa Barbero Arcos.,28,INICIATIVA FEMINISTA (I.Fem),I.Fem,False
28,1,Vicente, Vicente Igor Galduf Cabañas.,29,INICIATIVA FEMINISTA (I.Fem),I.Fem,False
29,1,Blas, Blas Caballero Martínez.,30,INICIATIVA FEMINISTA (I.Fem),I.Fem,False
30,1,Cristina, Cristina Gonzálvez Mira.,31,INICIATIVA FEMINISTA (I.Fem),I.Fem,False
31,1,Maria, María Teresa Vidal Ferreres.,32,INICIATIVA FEMINISTA (I.Fem),I.Fem,False
32,1,Vicenta, Vicenta Sanz Bellver.,33,INICIATIVA FEMINISTA (I.Fem),I.Fem,False
33,1,Jose, José Vicente López Roger.,34,INICIATIVA FEMINISTA (I.Fem),I.Fem,False
34,1,Alberto, Alberto Antonio Hernández Ramos.,35,INICIATIVA FEMINISTA (I.Fem),I.Fem,False
35,1,Dolores, Dolores Luz Bravo de Laguna Muñoz.,36,INICIATIVA FEMINISTA (I.Fem),I.Fem,False
36,1,Ana, Ana María Miguel Mínguez.,37,INICIATIVA FEMINISTA (I.Fem),I.Fem,False
37,1,Mireia, Mireia Neus Renau Claramonte.,38,INICIATIVA FEMINISTA (I.Fem),I.Fem,False
38,1,Rafael, Rafael López Cañete.,39,INICIATIVA FEMINISTA (I.Fem),I.Fem,False
39,1,Hector, Héctor Conde Rodríguez.,40,INICIATIVA FEMINISTA (I.Fem),I.Fem,False
40,1,Antonia, Antonia Caballero Rubio.,41,INICIATIVA FEMINISTA (I.Fem),I.Fem,False
41,1,Tibisay, Tibisay Pérez Cervera.,42,INICIATIVA FEMINISTA (I.Fem),I.Fem,False
42,1,Estefania, Estefanía Morcillo Dorta.,43,INICIATIVA FEMINISTA (I.Fem),I.Fem,False
43,1,Juan, Juan Bernal Giménez.,44,INICIATIVA FEMINISTA (I.Fem),I.Fem,False
44,1,Pere, Pere Serra Guardia.,45,INICIATIVA FEMINISTA (I.Fem),I.Fem,False
45,1,Maria, María Teresa Rodríguez de la Fuente.,46,INICIATIVA FEMINISTA (I.Fem),I.Fem,False
46,1,Ana, Ana María Álvarez Montalbán.,47,INICIATIVA FEMINISTA (I.Fem),I.Fem,False
47,1,Juana, Juana María Domínguez Ramos.,48,INICIATIVA FEMINISTA (I.Fem),I.Fem,False
48,1,Jose, José Antonio Tamayo Arana.,49,INICIATIVA FEMINISTA (I.Fem),I.Fem,False
49,1,Julio, Julio Palomares Collado.,50,INICIATIVA FEMINISTA (I.Fem),I.Fem,False
50,1,Maria, María Luisa Tardío Alonso.,51,INICIATIVA FEMINISTA (I.Fem),I.Fem,False
51,1,Regulo, Régulo Daniel Hernández Talavera.,52,INICIATIVA FEMINISTA (I.Fem),I.Fem,False
52,1,Ivan, Iván Velasco Egido.,53,INICIATIVA FEMINISTA (I.Fem),I.Fem,False
53,1,Nathalia, Nathalia Solarte Clavijo.,54,INICIATIVA FEMINISTA (I.Fem),I.Fem,False
54,1,Maria, María Concepción Martos García.,1,INICIATIVA FEMINISTA (I.Fem),I.Fem,True
55,1,Maria, María Dolores del Carmen García Arencibia.,2,INICIATIVA FEMINISTA (I.Fem),I.Fem,True
56,1,Vicente, Vicente Jesús Travieso Rodríguez.,3,INICIATIVA FEMINISTA (I.Fem),I.Fem,True
57,1,Maria, María Pino Vega Romero.,4,INICIATIVA FEMINISTA (I.Fem),I.Fem,True
58,1,Edgar, Edgar Miguel Hernández Talavera.,5,INICIATIVA FEMINISTA (I.Fem),I.Fem,True
59,1,Maria, María del Carmen Velasco Egido.,6,INICIATIVA FEMINISTA (I.Fem),I.Fem,True
60,1,Maria, María Luisa Salvador Vicente.,7,INICIATIVA FEMINISTA (I.Fem),I.Fem,True
61,1,Maria, María del Carmen Garcerá Marco.,8,INICIATIVA FEMINISTA (I.Fem),I.Fem,True
62,1,Juan, Juan Rafael Hierro Rivero.,9,INICIATIVA FEMINISTA (I.Fem),I.Fem,True
63,1,Manuel, Manuel Javier Castro Fernández.,10,INICIATIVA FEMINISTA (I.Fem),I.Fem,True
64,2,Elena, Elena Valenciano Martínez-Orozco.,1,PARTIDO SOCIALISTA OBRERO ESPAÑOL (PSOE),PSOE,False
65,2,Ramon, Ramón Jáuregui Atondo.,2,PARTIDO SOCIALISTA OBRERO ESPAÑOL (PSOE),PSOE,False
66,2,Soledad, Soledad Cabezón Ruiz.,3,PARTIDO SOCIALISTA OBRERO ESPAÑOL (PSOE),PSOE,False
67,2,Juan, Juan Fernando López Aguilar.,4,PARTIDO SOCIALISTA OBRERO ESPAÑOL (PSOE),PSOE,False
68,2,Iratxe, Iratxe García Pérez.,5,PARTIDO SOCIALISTA OBRERO ESPAÑOL (PSOE),PSOE,False
69,2,Javier, Javier López Fernández.,6,PARTIDO SOCIALISTA OBRERO ESPAÑOL (PSOE),PSOE,False
70,2,Inmaculada, Inmaculada Rodríguez-Piñero Fernández.,7,PARTIDO SOCIALISTA OBRERO ESPAÑOL (PSOE),PSOE,False
71,2,Enrique, Enrique Guerrero Salom.,8,PARTIDO SOCIALISTA OBRERO ESPAÑOL (PSOE),PSOE,False
72,2,Eider, Eider Gardiazábal Rubial.,9,PARTIDO SOCIALISTA OBRERO ESPAÑOL (PSOE),PSOE,False
73,2,Jose, José Blanco López.,10,PARTIDO SOCIALISTA OBRERO ESPAÑOL (PSOE),PSOE,False
74,2,Clara, Clara Eugenia Aguilera García.,11,PARTIDO SOCIALISTA OBRERO ESPAÑOL (PSOE),PSOE,False
75,2,Sergio, Sergio Gutiérrez Prieto.,12,PARTIDO SOCIALISTA OBRERO ESPAÑOL (PSOE),PSOE,False
76,2,Ines, Inés Ayala Sender.,13,PARTIDO SOCIALISTA OBRERO ESPAÑOL (PSOE),PSOE,False
77,2,Jonas, Jonás Fernández Álvarez.,14,PARTIDO SOCIALISTA OBRERO ESPAÑOL (PSOE),PSOE,False
78,2,Esther, Esther Niubó Cidoncha.,15,PARTIDO SOCIALISTA OBRERO ESPAÑOL (PSOE),PSOE,False
79,2,Borja, Borja Cabezón Royo.,16,PARTIDO SOCIALISTA OBRERO ESPAÑOL (PSOE),PSOE,False
80,2,Maria, María del Carmen Ortiz Rivas.,17,PARTIDO SOCIALISTA OBRERO ESPAÑOL (PSOE),PSOE,False
81,2,Ricardo, Ricardo Cortés Lastra.,18,PARTIDO SOCIALISTA OBRERO ESPAÑOL (PSOE),PSOE,False
82,2,Maria, María Begoña García Bernal.,19,PARTIDO SOCIALISTA OBRERO ESPAÑOL (PSOE),PSOE,False
83,2,Pere, Pere Joan Pons Sampietro.,20,PARTIDO SOCIALISTA OBRERO ESPAÑOL (PSOE),PSOE,False
84,2,Maria, María Paloma Muñiz de Urquiza.,21,PARTIDO SOCIALISTA OBRERO ESPAÑOL (PSOE),PSOE,False
85,2,Juan, Juan Ramón Ferreira Alonso.,22,PARTIDO SOCIALISTA OBRERO ESPAÑOL (PSOE),PSOE,False
86,2,Isabel, Isabel Casalduero Jódar.,23,PARTIDO SOCIALISTA OBRERO ESPAÑOL (PSOE),PSOE,False
87,2,Alejandro, Alejandro Colldefors Bergnes de las Casas.,24,PARTIDO SOCIALISTA OBRERO ESPAÑOL (PSOE),PSOE,False
88,2,Rosa, Rosa María Balas Torres.,25,PARTIDO SOCIALISTA OBRERO ESPAÑOL (PSOE),PSOE,False
89,2,Jose, José Manuel Domínguez López.,26,PARTIDO SOCIALISTA OBRERO ESPAÑOL (PSOE),PSOE,False
90,2,Concepcion, Concepción Andreu Rodríguez.,27,PARTIDO SOCIALISTA OBRERO ESPAÑOL (PSOE),PSOE,False
91,2,Alfonso, Alfonso Carlos Mateo Miranda.,28,PARTIDO SOCIALISTA OBRERO ESPAÑOL (PSOE),PSOE,False
92,2,Izaskun, Izaskun Bernal Cerdeira.,29,PARTIDO SOCIALISTA OBRERO ESPAÑOL (PSOE),PSOE,False
93,2,Mohammed, Mohammed Azahaf Moumen.,30,PARTIDO SOCIALISTA OBRERO ESPAÑOL (PSOE),PSOE,False
94,2,Maria, María Paz Ojeda Giménez.,31,PARTIDO SOCIALISTA OBRERO ESPAÑOL (PSOE),PSOE,False
95,2,Samuel, Samuel Falomir Sancho.,32,PARTIDO SOCIALISTA OBRERO ESPAÑOL (PSOE),PSOE,False
96,2,Angela, Ángela Sabater García.,33,PARTIDO SOCIALISTA OBRERO ESPAÑOL (PSOE),PSOE,False
97,2,Sergio, Sergio Chueca Urzay.,34,PARTIDO SOCIALISTA OBRERO ESPAÑOL (PSOE),PSOE,False
98,2,Maider, Maider Laínez Lazcoz.,35,PARTIDO SOCIALISTA OBRERO ESPAÑOL (PSOE),PSOE,False
99,2,Antonio, Antonio Luengo Rodríguez.,36,PARTIDO SOCIALISTA OBRERO ESPAÑOL (PSOE),PSOE,False
100,2,Diana, Diana Salvadó Artells.,37,PARTIDO SOCIALISTA OBRERO ESPAÑOL (PSOE),PSOE,False
101,2,Juan, Juan Francisco Rodríguez Sánchez.,38,PARTIDO SOCIALISTA OBRERO ESPAÑOL (PSOE),PSOE,False
102,2,Maria, María del Cristo Dorta López.,39,PARTIDO SOCIALISTA OBRERO ESPAÑOL (PSOE),PSOE,False
103,2,Eduard, Eduard Rivas Mateo.,40,PARTIDO SOCIALISTA OBRERO ESPAÑOL (PSOE),PSOE,False
104,2,Estefania, Estefanía Torres Sánchez.,41,PARTIDO SOCIALISTA OBRERO ESPAÑOL (PSOE),PSOE,False
105,2,Nicolas, Nicolás González Casares.,42,PARTIDO SOCIALISTA OBRERO ESPAÑOL (PSOE),PSOE,False
106,2,Naxalli, Naxalli Lozano Hernández.,43,PARTIDO SOCIALISTA OBRERO ESPAÑOL (PSOE),PSOE,False
107,2,Eduardo, Eduardo Abascal Falces.,44,PARTIDO SOCIALISTA OBRERO ESPAÑOL (PSOE),PSOE,False
108,2,Carmen, Carmen Espín Quirante.,45,PARTIDO SOCIALISTA OBRERO ESPAÑOL (PSOE),PSOE,False
109,2,Emilio, Emilio Ivars Ferrer.,46,PARTIDO SOCIALISTA OBRERO ESPAÑOL (PSOE),PSOE,False
110,2,Angela, Ángela María López Vargas.,47,PARTIDO SOCIALISTA OBRERO ESPAÑOL (PSOE),PSOE,False
111,2,Santiago, Santiago Ekain Rico Lezama.,48,PARTIDO SOCIALISTA OBRERO ESPAÑOL (PSOE),PSOE,False
112,2,Maria, María Bella Martín Eugenio.,49,PARTIDO SOCIALISTA OBRERO ESPAÑOL (PSOE),PSOE,False
113,2,Jose, José Ángel Santoro Estévez.,50,PARTIDO SOCIALISTA OBRERO ESPAÑOL (PSOE),PSOE,False
114,2,Saray, Saray Soria García.,51,PARTIDO SOCIALISTA OBRERO ESPAÑOL (PSOE),PSOE,False
115,2,Miquel, Miquel Company Pons.,52,PARTIDO SOCIALISTA OBRERO ESPAÑOL (PSOE),PSOE,False
116,2,Rosa, Rosa Peñalver Pérez.,53,PARTIDO SOCIALISTA OBRERO ESPAÑOL (PSOE),PSOE,False
117,2,Miguel, Miguel Ángel Martínez Martínez.,54,PARTIDO SOCIALISTA OBRERO ESPAÑOL (PSOE),PSOE,False
118,2,Estela, Estela Goicoechea Alonso.,1,PARTIDO SOCIALISTA OBRERO ESPAÑOL (PSOE),PSOE,True
119,2,Miguel, Miguel Chover Lara.,2,PARTIDO SOCIALISTA OBRERO ESPAÑOL (PSOE),PSOE,True
120,2,Rosa, Rosa María Orriols Ramos.,3,PARTIDO SOCIALISTA OBRERO ESPAÑOL (PSOE),PSOE,True
121,2,Jose, José Ramón Funes Toyos.,4,PARTIDO SOCIALISTA OBRERO ESPAÑOL (PSOE),PSOE,True
122,2,Miriam, Miriam Ruiz Sanz.,5,PARTIDO SOCIALISTA OBRERO ESPAÑOL (PSOE),PSOE,True
123,2,Oscar, Óscar Pérez Suárez.,6,PARTIDO SOCIALISTA OBRERO ESPAÑOL (PSOE),PSOE,True
124,3,Miguel, Miguel Arias Cañete.,1,PARTIDO POPULAR (P.P.),P.P.,False
125,3,Esteban, Esteban González Pons.,2,PARTIDO POPULAR (P.P.),P.P.,False
126,3,Maria, María Teresa Jiménez Becerril Barrio.,3,PARTIDO POPULAR (P.P.),P.P.,False
127,3,Luis, Luis de Grandes Pascual.,4,PARTIDO POPULAR (P.P.),P.P.,False
128,3,Pilar, Pilar del Castillo Vera.,5,PARTIDO POPULAR (P.P.),P.P.,False
129,3,Ramon, Ramón Luis Valcárcel Siso.,6,PARTIDO POPULAR (P.P.),P.P.,False
130,3,Maria, María Rosa Estarás Ferragut.,7,PARTIDO POPULAR (P.P.),P.P.,False
131,3,Francisco, Francisco José Millán Mon.,8,PARTIDO POPULAR (P.P.),P.P.,False
132,3,Pablo, Pablo Zalba Bidegain.,9,PARTIDO POPULAR (P.P.),P.P.,False
133,3,Veronica, Verónica Lope Fontagne.,10,PARTIDO POPULAR (P.P.),P.P.,False
134,3,Antonio, Antonio López-Istúriz White.,11,PARTIDO POPULAR (P.P.),P.P.,False
135,3,Santiago, Santiago Fisas Ayxela.,12,PARTIDO POPULAR (P.P.),P.P.,False
136,3,Gabriel, Gabriel Mato Adrover.,13,PARTIDO POPULAR (P.P.),P.P.,False
137,3,Maria, María del Pilar Ayuso González.,14,PARTIDO POPULAR (P.P.),P.P.,False
138,3,Maria, María Esther Herranz García.,15,PARTIDO POPULAR (P.P.),P.P.,False
139,3,Agustin, Agustín Díaz de Mera García Consuegra.,16,PARTIDO POPULAR (P.P.),P.P.,False
140,3,Carlos, Carlos Iturgaiz Angulo.,17,PARTIDO POPULAR (P.P.),P.P.,False
141,3,Jose, José Ignacio Salafranca Sánchez-Neyra.,18,PARTIDO POPULAR (P.P.),P.P.,False
142,3,Maria, María Auxiliadora Correa Zamora.,19,PARTIDO POPULAR (P.P.),P.P.,False
143,3,Eva, Eva Ortíz Vilella.,20,PARTIDO POPULAR (P.P.),P.P.,False
144,3,Pablo, Pablo Arias Echeverría.,21,PARTIDO POPULAR (P.P.),P.P.,False
145,3,Salvador, Salvador Garriga Polledo.,22,PARTIDO POPULAR (P.P.),P.P.,False
146,3,Gabino, Gabino Puche Rodríguez-Acosta.,23,PARTIDO POPULAR (P.P.),P.P.,False
147,3,Maria, María Luisa Peón Pérez.,24,PARTIDO POPULAR (P.P.),P.P.,False
148,3,Maria, María del Carmen Pardo López.,25,PARTIDO POPULAR (P.P.),P.P.,False
149,3,Juan, Juan Andrés Naranjo Escobar.,26,PARTIDO POPULAR (P.P.),P.P.,False
150,3,Pablo, Pablo José Venzal Contreras.,27,PARTIDO POPULAR (P.P.),P.P.,False
151,3,Sofia, Sofía Acedo Reyes.,28,PARTIDO POPULAR (P.P.),P.P.,False
152,3,Rocio, Rocío Salcedo López.,29,PARTIDO POPULAR (P.P.),P.P.,False
153,3,Antonio, Antonio Pablo González Terol.,30,PARTIDO POPULAR (P.P.),P.P.,False
154,3,Javier, Javier Fernández Soberón.,31,PARTIDO POPULAR (P.P.),P.P.,False
155,3,Maria, María Roldán García.,32,PARTIDO POPULAR (P.P.),P.P.,False
156,3,Zoe, Zoe Iratxe Nubla Durango.,33,PARTIDO POPULAR (P.P.),P.P.,False
157,3,Francisco, Francisco Javier Bermúdez Carrillo.,34,PARTIDO POPULAR (P.P.),P.P.,False
158,3,Juan, Juan Carlos Caballero Montañés.,35,PARTIDO POPULAR (P.P.),P.P.,False
159,3,Mirian, Mirian Rabaneda Gudiel.,36,PARTIDO POPULAR (P.P.),P.P.,False
160,3,Pedro, Pedro Juan Muriel Tato.,37,PARTIDO POPULAR (P.P.),P.P.,False
161,3,Francisco, Francisco Javier Bravo Fernández.,38,PARTIDO POPULAR (P.P.),P.P.,False
162,3,Andrea, Andrea Levy Soler.,39,PARTIDO POPULAR (P.P.),P.P.,False
163,3,Enrique, Enrique Sánchez-Guijo Acevedo.,40,PARTIDO POPULAR (P.P.),P.P.,False
164,3,Noelia, Noelia Moreno Hernández.,41,PARTIDO POPULAR (P.P.),P.P.,False
165,3,Fernando, Fernando Ledesma Gelas.,42,PARTIDO POPULAR (P.P.),P.P.,False
166,3,Jose, José Luis Torres Gutiérrez.,43,PARTIDO POPULAR (P.P.),P.P.,False
167,3,Marta, Marta Lorenzo Cavero.,44,PARTIDO POPULAR (P.P.),P.P.,False
168,3,Marino, Marino Arranz Boal.,45,PARTIDO POPULAR (P.P.),P.P.,False
169,3,Marius, Marius Ionel Ioan.,46,PARTIDO POPULAR (P.P.),P.P.,False
170,3,Daniel, Daniel Ortíz Espejo.,47,PARTIDO POPULAR (P.P.),P.P.,False
171,3,Irene, Irene Isabel Oliver Montell.,48,PARTIDO POPULAR (P.P.),P.P.,False
172,3,Silvia, Silvia Muñoz Moreno.,49,PARTIDO POPULAR (P.P.),P.P.,False
173,3,Ana, Ana María de Requesens Moll.,50,PARTIDO POPULAR (P.P.),P.P.,False
174,3,Francisco, Francisco de Borja Fanjul Fernández-Pita.,51,PARTIDO POPULAR (P.P.),P.P.,False
175,3,Maria, María Isabel Fernández Pérez.,52,PARTIDO POPULAR (P.P.),P.P.,False
176,3,Carla, Carla Miralles Castella.,53,PARTIDO POPULAR (P.P.),P.P.,False
177,3,Federico, Federico Pozuelo Vidal.,54,PARTIDO POPULAR (P.P.),P.P.,False
178,3,Maria, María Inmaculada Múgica Ustarroz.,1,PARTIDO POPULAR (P.P.),P.P.,True
179,3,Joaquin, Joaquín Calvo Basarán.,2,PARTIDO POPULAR (P.P.),P.P.,True
180,3,Jose, José Ortíz Pintor.,3,PARTIDO POPULAR (P.P.),P.P.,True
181,3,Eloisa, Eloisa Trillo-Figueroa Ávila.,4,PARTIDO POPULAR (P.P.),P.P.,True
182,3,Cristina, Cristina Flora Molina Ciudad.,5,PARTIDO POPULAR (P.P.),P.P.,True
183,4,Ramon, Ramón Tremosa i Balcells (CiU).,1,COALICIÓN POR EUROPA (CEU),CEU,False
184,4,Izaskun, Izaskun Bilbao Barandica (EAJ-PNV).,2,COALICIÓN POR EUROPA (CEU),CEU,False
185,4,Francesc, Francesc de P. Gambús i Millet (CiU).,3,COALICIÓN POR EUROPA (CEU),CEU,False
186,4,Jose, José Javier Morales Febles (CCa-PNC).,4,COALICIÓN POR EUROPA (CEU),CEU,False
187,4,Mireia, Mireia Canals i Botines (CiU).,5,COALICIÓN POR EUROPA (CEU),CEU,False
188,4,Paulo, Paulo Carlos López López (CxG).,6,COALICIÓN POR EUROPA (CEU),CEU,False
189,4,Izaskun, Izaskun Goñi Razquin (EAJ-PNV).,7,COALICIÓN POR EUROPA (CEU),CEU,False
190,4,Monserrat, Monserrat Aymamí i Viadé (CiU).,8,COALICIÓN POR EUROPA (CEU),CEU,False
191,4,David, David Fernando Baso Díaz (CCa-PNC).,9,COALICIÓN POR EUROPA (CEU),CEU,False
192,4,Marta, Marta Canós i Solé (CiU).,10,COALICIÓN POR EUROPA (CEU),CEU,False
193,4,Xabier, Xabier Ezeizabarrena Saenz (EAJ-PNV).,11,COALICIÓN POR EUROPA (CEU),CEU,False
194,4,Luca, Luca Bellizzi i Cerri (CiU).,12,COALICIÓN POR EUROPA (CEU),CEU,False
195,4,Maria, María Beatriz Acosta Guerra (CCa-PNC).,13,COALICIÓN POR EUROPA (CEU),CEU,False
196,4,Olga, Olga Ortiz i Moreno (CiU).,14,COALICIÓN POR EUROPA (CEU),CEU,False
197,4,Oscar, Óscar Carballo Iglesias (CxG).,15,COALICIÓN POR EUROPA (CEU),CEU,False
198,4,Idoia, Idoia Goiri Zamora (EAJ-PNV).,16,COALICIÓN POR EUROPA (CEU),CEU,False
199,4,Carmen, Carmen Dolores Morales Rodríguez (CCa-PNC).,17,COALICIÓN POR EUROPA (CEU),CEU,False
200,4,Gerard, Gerard Vidal i Pallarès (CiU).,18,COALICIÓN POR EUROPA (CEU),CEU,False
201,4,Josep, Josep Maria Llop i Rigol (CiU).,19,COALICIÓN POR EUROPA (CEU),CEU,False
202,4,Jordi, Jordi Agràs i Estalella (CiU).,20,COALICIÓN POR EUROPA (CEU),CEU,False
203,4,Jose, José Carmelo Afonso Ramírez (CCa-PNC).,21,COALICIÓN POR EUROPA (CEU),CEU,False
204,4,Marti, Martí Pujals i Castelló (CiU).,22,COALICIÓN POR EUROPA (CEU),CEU,False
205,4,Inmaculada, Inmaculada López Silva (CxG).,23,COALICIÓN POR EUROPA (CEU),CEU,False
206,4,Joseba, Joseba Koldobika Bilbao Uriarte (EAJ-PNV).,24,COALICIÓN POR EUROPA (CEU),CEU,False
207,4,Lidia, Lídia Aixalà i Coll (CiU).,25,COALICIÓN POR EUROPA (CEU),CEU,False
208,4,Simo, Simó Schwartz i Riera (CiU).,26,COALICIÓN POR EUROPA (CEU),CEU,False
209,4,Adargoma, Adargoma Hernandéz Rodríguez (CCa-PNC).,27,COALICIÓN POR EUROPA (CEU),CEU,False
210,4,Eider, Eider Mendoza Larrañaga (EAJ-PNV).,28,COALICIÓN POR EUROPA (CEU),CEU,False
211,4,Pilar, Pilar Giró i Román (CiU).,29,COALICIÓN POR EUROPA (CEU),CEU,False
212,4,Miguel, Miguel Garay Rodríguez de Mendarozqueta (EAJ-PNV).,30,COALICIÓN POR EUROPA (CEU),CEU,False
213,4,Idoia, Idoia Sagastizabal Unzetabarrenetxea (EAJ-PNV).,31,COALICIÓN POR EUROPA (CEU),CEU,False
214,4,Joan, Joan Pere Gómez i Comes (CiU).,32,COALICIÓN POR EUROPA (CEU),CEU,False
215,4,Teba, Teba Conde Herrezuelo (CxG).,33,COALICIÓN POR EUROPA (CEU),CEU,False
216,4,Francesc, Francesc Sabanés i Serra (CiU).,34,COALICIÓN POR EUROPA (CEU),CEU,False
217,4,Luke, Luke Uribe-Etxebarria Apalategi (EAJ-PNV).,35,COALICIÓN POR EUROPA (CEU),CEU,False
218,4,Xavier, Xavier Giner i Cros (CiU).,36,COALICIÓN POR EUROPA (CEU),CEU,False
219,4,Maria, Maria Victoria de Urresti García (EAJ-PNV).,37,COALICIÓN POR EUROPA (CEU),CEU,False
220,4,Marta, Marta Canales i Portolés (CiU).,38,COALICIÓN POR EUROPA (CEU),CEU,False
221,4,Inaki, Iñaki Agirre Arizmendi (EAJ-PNV).,39,COALICIÓN POR EUROPA (CEU),CEU,False
222,4,Estefania, Estefania Serrano i Agudo (CiU).,40,COALICIÓN POR EUROPA (CEU),CEU,False
223,4,Pere, Pere Morán i Ortigosa (CiU).,41,COALICIÓN POR EUROPA (CEU),CEU,False
224,4,Susana, Susana Rivero i Baughman (CiU).,42,COALICIÓN POR EUROPA (CEU),CEU,False
225,4,Diana, Diana González García (EAJ-PNV).,43,COALICIÓN POR EUROPA (CEU),CEU,False
226,4,Victor, Victor Andrés Álvarez Arias (CxG).,44,COALICIÓN POR EUROPA (CEU),CEU,False
227,4,Nahikari, Nahikari Otermin Soroa (EAJ-PNV).,45,COALICIÓN POR EUROPA (CEU),CEU,False
228,4,Andres, Andrés Nuñez Rajoy (CxG).,46,COALICIÓN POR EUROPA (CEU),CEU,False
229,4,Joseba, Joseba Iñaki Arregi Orue (EAJ-PNV).,47,COALICIÓN POR EUROPA (CEU),CEU,False
230,4,Susana, Susana Cano i Olmos (CiU).,48,COALICIÓN POR EUROPA (CEU),CEU,False
231,4,Aitor, Aitor Ibarra Herrero (EAJ-PNV).,49,COALICIÓN POR EUROPA (CEU),CEU,False
232,4,Roser, Roser Capdevila i Saureu (CiU).,50,COALICIÓN POR EUROPA (CEU),CEU,False
233,4,Abraham, Abraham Darias Barroso (CCa-PNC).,51,COALICIÓN POR EUROPA (CEU),CEU,False
234,4,Attissa, Attissa Tirma Jimeno i Sánchez (CiU).,52,COALICIÓN POR EUROPA (CEU),CEU,False
235,4,Miren, Miren Martiarena Barkaiztegi (EAJ-PNV).,53,COALICIÓN POR EUROPA (CEU),CEU,False
236,4,Marc, Marc Guerrero i Tarragó (CiU).,54,COALICIÓN POR EUROPA (CEU),CEU,False
237,4,Josep, Josep Palau i Castells (CiU).,1,COALICIÓN POR EUROPA (CEU),CEU,True
238,4,Maixabel, Maixabel Azpillaga Aranbarri (EAJ-PNV).,2,COALICIÓN POR EUROPA (CEU),CEU,True
239,4,Jordi, Jordi Barón i Escriche (CiU).,3,COALICIÓN POR EUROPA (CEU),CEU,True
240,4,Alexander, Alexander Zapirain Gorostegi (EAJ-PNV).,4,COALICIÓN POR EUROPA (CEU),CEU,True
241,4,Maria, Maria Xosé Alfonso Torres (CxG).,5,COALICIÓN POR EUROPA (CEU),CEU,True
242,4,Amaia, Amaia Arrizabalaga Idiakez (EAJ-PNV).,6,COALICIÓN POR EUROPA (CEU),CEU,True
243,4,Marcel, Marcel Sayol i Quadres (CiU).,7,COALICIÓN POR EUROPA (CEU),CEU,True
244,4,Mikel, Mikel Zamakona Usubiaga (EAJ-PNV).,8,COALICIÓN POR EUROPA (CEU),CEU,True
245,4,Silvia, Sílvia Mayor i Gutiérrez (CiU).,9,COALICIÓN POR EUROPA (CEU),CEU,True
246,4,Sergi, Sergi Ocaña i Llanes (CiU).,10,COALICIÓN POR EUROPA (CEU),CEU,True
247,5,Argimiro, Argimiro Rodríguez Guerra.,1,FORO DE CIUDADANOS (F.A.C.),F.A.C.,False
248,5,Carolina, Carolina Morilla Cernuda.,2,FORO DE CIUDADANOS (F.A.C.),F.A.C.,False
249,5,Ignacio, Ignacio Onís Peral.,3,FORO DE CIUDADANOS (F.A.C.),F.A.C.,False
250,5,Albano, Albano Longo Álvarez.,4,FORO DE CIUDADANOS (F.A.C.),F.A.C.,False
251,5,Patricia, Patricia García Villanueva.,5,FORO DE CIUDADANOS (F.A.C.),F.A.C.,False
252,5,Maria, María del Carmen Moriyón Entrialgo.,6,FORO DE CIUDADANOS (F.A.C.),F.A.C.,False
253,5,Eduardo, Eduardo Enrique Martínez Llosa.,7,FORO DE CIUDADANOS (F.A.C.),F.A.C.,False
254,5,Jose, José Modesto Vallejo Ibáñez.,8,FORO DE CIUDADANOS (F.A.C.),F.A.C.,False
255,5,Rosario, Rosario Montserrat Fernández Román.,9,FORO DE CIUDADANOS (F.A.C.),F.A.C.,False
256,5,Sergio, Sergio Hidalgo Alonso.,10,FORO DE CIUDADANOS (F.A.C.),F.A.C.,False
257,5,Carlos, Carlos Javier Puente Fernández.,11,FORO DE CIUDADANOS (F.A.C.),F.A.C.,False
258,5,Jose, José Ron Méndez.,12,FORO DE CIUDADANOS (F.A.C.),F.A.C.,False
259,5,Jose, José Félix Fernández Fernández.,13,FORO DE CIUDADANOS (F.A.C.),F.A.C.,False
260,5,M.a, M.ª de las Mercedes Traviesa Priede.,14,FORO DE CIUDADANOS (F.A.C.),F.A.C.,False
261,5,Rosa, Rosa María Domínguez de Posada Puertas.,15,FORO DE CIUDADANOS (F.A.C.),F.A.C.,False
262,5,Juan, Juan José Vega Alonso.,16,FORO DE CIUDADANOS (F.A.C.),F.A.C.,False
263,5,M.a, M.ª Covadonga García Llana.,17,FORO DE CIUDADANOS (F.A.C.),F.A.C.,False
264,5,Pedro, Pedro Leal Llaneza.,18,FORO DE CIUDADANOS (F.A.C.),F.A.C.,False
265,5,Jose, José María Navia-Osorio García-Braga.,19,FORO DE CIUDADANOS (F.A.C.),F.A.C.,False
266,5,Maria, María Jesús Alonso Collado.,20,FORO DE CIUDADANOS (F.A.C.),F.A.C.,False
267,5,Inaciu, Inaciu Iglesias Fernández.,21,FORO DE CIUDADANOS (F.A.C.),F.A.C.,False
268,5,Jose, José Luis Magro Esteban.,22,FORO DE CIUDADANOS (F.A.C.),F.A.C.,False
269,5,Pablo, Pablo Sánchez Lorda.,23,FORO DE CIUDADANOS (F.A.C.),F.A.C.,False
270,5,Maria, María Teresa Domínguez Murias.,24,FORO DE CIUDADANOS (F.A.C.),F.A.C.,False
271,5,Maria, María Belén Arganza Alvaro.,25,FORO DE CIUDADANOS (F.A.C.),F.A.C.,False
272,5,Sixto, Sixto Antonio Orejas Pedregal.,26,FORO DE CIUDADANOS (F.A.C.),F.A.C.,False
273,5,Maria, María Eugenia del Valle Maquinay.,27,FORO DE CIUDADANOS (F.A.C.),F.A.C.,False
274,5,Manuel, Manuel Ángel Rosal Rodríguez.,28,FORO DE CIUDADANOS (F.A.C.),F.A.C.,False
275,5,Juan, Juan Carlos Fernández González.,29,FORO DE CIUDADANOS (F.A.C.),F.A.C.,False
276,5,Maria, María del Camino Gutiérrez Gutiérrez.,30,FORO DE CIUDADANOS (F.A.C.),F.A.C.,False
277,5,Jose, José Manuel Fernández Lavandera.,31,FORO DE CIUDADANOS (F.A.C.),F.A.C.,False
278,5,Maria, María Paloma Menéndez Prado.,32,FORO DE CIUDADANOS (F.A.C.),F.A.C.,False
279,5,Jose, José Antonio Rodríguez Rugarcía.,33,FORO DE CIUDADANOS (F.A.C.),F.A.C.,False
280,5,Maria, María Isabel Marqués García.,34,FORO DE CIUDADANOS (F.A.C.),F.A.C.,False
281,5,Manuel, Manuel Antonio López Tamargo.,35,FORO DE CIUDADANOS (F.A.C.),F.A.C.,False
282,5,Enrique, Enrique Lanza Morán.,36,FORO DE CIUDADANOS (F.A.C.),F.A.C.,False
283,5,Manuel, Manuel Fano Alonso.,37,FORO DE CIUDADANOS (F.A.C.),F.A.C.,False
284,5,Pablo, Pablo Calvo Labra.,38,FORO DE CIUDADANOS (F.A.C.),F.A.C.,False
285,5,M.a, M.ª del Mar García Poó.,39,FORO DE CIUDADANOS (F.A.C.),F.A.C.,False
286,5,M.a, M.ª del Carmen Fernández Gómez.,40,FORO DE CIUDADANOS (F.A.C.),F.A.C.,False
287,5,Manuel, Manuel Peña Sánchez.,41,FORO DE CIUDADANOS (F.A.C.),F.A.C.,False
288,5,M.a, M.ª Teresa Alonso Pérez.,42,FORO DE CIUDADANOS (F.A.C.),F.A.C.,False
289,5,Jose, José Antonio Martínez Fernández.,43,FORO DE CIUDADANOS (F.A.C.),F.A.C.,False
290,5,Esther, Esther Landa Riera.,44,FORO DE CIUDADANOS (F.A.C.),F.A.C.,False
291,5,Juan, Juan Ramón Campo Fernández.,45,FORO DE CIUDADANOS (F.A.C.),F.A.C.,False
292,5,Marina, Marina Huerta Vega.,46,FORO DE CIUDADANOS (F.A.C.),F.A.C.,False
293,5,Pelayo, Pelayo Roces Arbesú.,47,FORO DE CIUDADANOS (F.A.C.),F.A.C.,False
294,5,Cristina, Cristina Coto de la Mata.,48,FORO DE CIUDADANOS (F.A.C.),F.A.C.,False
295,5,Isidro, Isidro Manuel Martínez Oblanca.,49,FORO DE CIUDADANOS (F.A.C.),F.A.C.,False
296,5,Enrique, Enrique Álvarez Sostres.,50,FORO DE CIUDADANOS (F.A.C.),F.A.C.,False
297,5,Concepcion, Concepción Lago Álvarez.,51,FORO DE CIUDADANOS (F.A.C.),F.A.C.,False
