,candidatura,nombre,nombre_completo,numero,partido,siglas,suplente
563,10,Josep, Josep Carreras García.,13,IMPULSO SOCIAL (ImpulsoSocial),ImpulsoSocial,False
564,10,Belen, Belén Fuente de Cobo.,14,IMPULSO SOCIAL (ImpulsoSocial),ImpulsoSocial,False
565,10,Maria, María del Mar Calderón Baquerizo.,15,IMPULSO SOCIAL (ImpulsoSocial),ImpulsoSocial,False
566,10,Jose, José Antonio Rodríguez Hervella.,16,IMPULSO SOCIAL (ImpulsoSocial),ImpulsoSocial,False
567,10,Adolfo, Adolfo Alustiza Romero.,17,IMPULSO SOCIAL (ImpulsoSocial),ImpulsoSocial,False
568,10,Pedro, Pedro de Alcantara de la Herrán Matorras.,18,IMPULSO SOCIAL (ImpulsoSocial),ImpulsoSocial,False
569,10,Maria, María Josefa Marban Paez.,19,IMPULSO SOCIAL (ImpulsoSocial),ImpulsoSocial,False
570,10,Maria, María Angeles Barrau Lena.,20,IMPULSO SOCIAL (ImpulsoSocial),ImpulsoSocial,False
571,10,Alfonso, Alfonso Hidalgo Ramos.,21,IMPULSO SOCIAL (ImpulsoSocial),ImpulsoSocial,False
572,10,Urko, Urko de Azumendi Beistegui.,22,IMPULSO SOCIAL (ImpulsoSocial),ImpulsoSocial,False
573,10,Jose, José Fermín Garralda Arizcun.,23,IMPULSO SOCIAL (ImpulsoSocial),ImpulsoSocial,False
574,10,Rosario, Rosario Victoria Andía García de Olalla.,24,IMPULSO SOCIAL (ImpulsoSocial),ImpulsoSocial,False
575,10,Maria, María Jesús Luzán González.,25,IMPULSO SOCIAL (ImpulsoSocial),ImpulsoSocial,False
576,10,Rafael, Rafael Mir Mena.,26,IMPULSO SOCIAL (ImpulsoSocial),ImpulsoSocial,False
577,10,Gerardo, Gerardo Matarán Ferreira.,27,IMPULSO SOCIAL (ImpulsoSocial),ImpulsoSocial,False
578,10,Jose, José María Malgosa Sanahuja.,28,IMPULSO SOCIAL (ImpulsoSocial),ImpulsoSocial,False
579,10,Teresa, Teresa González de Aguilar García.,29,IMPULSO SOCIAL (ImpulsoSocial),ImpulsoSocial,False
580,10,Margarita, Margarita del Pilar Cabrer Esteban.,30,IMPULSO SOCIAL (ImpulsoSocial),ImpulsoSocial,False
581,10,Juan, Juan Antonio Darder Colom.,31,IMPULSO SOCIAL (ImpulsoSocial),ImpulsoSocial,False
582,10,Victor, Víctor Puigdengolas Sustaeta.,32,IMPULSO SOCIAL (ImpulsoSocial),ImpulsoSocial,False
583,10,Victor, Víctor Jesús Castellanos Antón.,33,IMPULSO SOCIAL (ImpulsoSocial),ImpulsoSocial,False
584,10,Maria, María Luisa Santamaría Pérez.,34,IMPULSO SOCIAL (ImpulsoSocial),ImpulsoSocial,False
585,10,Maria, María Isabel Olivar Alvaro.,35,IMPULSO SOCIAL (ImpulsoSocial),ImpulsoSocial,False
586,10,Antonio, Antonio Jesús Barragán de las Cuevas.,36,IMPULSO SOCIAL (ImpulsoSocial),ImpulsoSocial,False
587,10,Santos, Santos Cándido Rull Segura.,37,IMPULSO SOCIAL (ImpulsoSocial),ImpulsoSocial,False
588,10,Jose, José Francisco Bustinza Aramburu.,38,IMPULSO SOCIAL (ImpulsoSocial),ImpulsoSocial,False
589,10,Maria, María del Valle Piñar Gutiérrez.,39,IMPULSO SOCIAL (ImpulsoSocial),ImpulsoSocial,False
590,10,Sonsoles, Sonsoles Ortiz de Zárate Fontes.,40,IMPULSO SOCIAL (ImpulsoSocial),ImpulsoSocial,False
591,10,Manuel, Manuel Ezequiel Chacón-Manrique de Lara Castilla.,41,IMPULSO SOCIAL (ImpulsoSocial),ImpulsoSocial,False
592,10,Rafael, Rafael Jesús Mancheño García.,42,IMPULSO SOCIAL (ImpulsoSocial),ImpulsoSocial,False
593,10,Juan, Juan Manuel Molina Valdés.,43,IMPULSO SOCIAL (ImpulsoSocial),ImpulsoSocial,False
594,10,Patricia, Patricia Palma Pérez.,44,IMPULSO SOCIAL (ImpulsoSocial),ImpulsoSocial,False
595,10,Pilar, Pilar Antonia Arroyo Sánchez.,45,IMPULSO SOCIAL (ImpulsoSocial),ImpulsoSocial,False
596,10,Francisco, Francisco Javier Toledo Marante.,46,IMPULSO SOCIAL (ImpulsoSocial),ImpulsoSocial,False
597,10,Antoni, Antoni Bas Olcina.,47,IMPULSO SOCIAL (ImpulsoSocial),ImpulsoSocial,False
598,10,Jose, José María Carrera Figueras.,48,IMPULSO SOCIAL (ImpulsoSocial),ImpulsoSocial,False
599,10,Myriam, Myriam Merino Thomas.,49,IMPULSO SOCIAL (ImpulsoSocial),ImpulsoSocial,False
600,10,Maria, María Desamparados Sustaeta Gómez.,50,IMPULSO SOCIAL (ImpulsoSocial),ImpulsoSocial,False
601,10,Susana, Susana María del Carmen Pascual Martín.,51,IMPULSO SOCIAL (ImpulsoSocial),ImpulsoSocial,False
602,10,Arturo, Arturo García Pertierra.,52,IMPULSO SOCIAL (ImpulsoSocial),ImpulsoSocial,False
603,10,Nuria, Nuria Vives Agurruza.,53,IMPULSO SOCIAL (ImpulsoSocial),ImpulsoSocial,False
604,10,Francisco, Francisco Torres García.,54,IMPULSO SOCIAL (ImpulsoSocial),ImpulsoSocial,False
605,10,Miguel, Miguel Aguilella Martínez.,1,IMPULSO SOCIAL (ImpulsoSocial),ImpulsoSocial,True
606,10,Miguel, Miguel Angel Bernáldez Gutiérrez.,2,IMPULSO SOCIAL (ImpulsoSocial),ImpulsoSocial,True
607,10,Angel, Angel Peña Pérez.,3,IMPULSO SOCIAL (ImpulsoSocial),ImpulsoSocial,True
608,10,Ana, Ana Isabel de Elías Cantalapiedra.,4,IMPULSO SOCIAL (ImpulsoSocial),ImpulsoSocial,True
609,10,Maria, María Pía Zazu Lafuente.,5,IMPULSO SOCIAL (ImpulsoSocial),ImpulsoSocial,True
610,10,Jose, José Miguel Orts Timoner.,6,IMPULSO SOCIAL (ImpulsoSocial),ImpulsoSocial,True
611,10,Pablo, Pablo Martín Tharrats.,7,IMPULSO SOCIAL (ImpulsoSocial),ImpulsoSocial,True
612,10,Macarena, Macarena Menéndez Piñar.,8,IMPULSO SOCIAL (ImpulsoSocial),ImpulsoSocial,True
613,10,Asuncion, Asunción Silvia Fernández-Pacheco López-Peláez.,9,IMPULSO SOCIAL (ImpulsoSocial),ImpulsoSocial,True
614,10,Vicente, Vicente Febrer Fores.,10,IMPULSO SOCIAL (ImpulsoSocial),ImpulsoSocial,True
615,11,Nuria, Nuria Suárez Hernández (RECORTES CERO).,1,AGRUPACIÓN DE ELECTORES RECORTES CERO (RECORTES CERO),RECORTES CERO,False
616,11,Esteban, Esteban Cabal Riera (RECORTES CERO).,2,AGRUPACIÓN DE ELECTORES RECORTES CERO (RECORTES CERO),RECORTES CERO,False
617,11,Ruth, Ruth Hernández Castro (RECORTES CERO).,3,AGRUPACIÓN DE ELECTORES RECORTES CERO (RECORTES CERO),RECORTES CERO,False
618,11,Miguel, Miguel Garre Olmos (RECORTES CERO).,4,AGRUPACIÓN DE ELECTORES RECORTES CERO (RECORTES CERO),RECORTES CERO,False
619,11,Divina, Divina Pastora Fernández García (RECORTES CERO).,5,AGRUPACIÓN DE ELECTORES RECORTES CERO (RECORTES CERO),RECORTES CERO,False
620,11,Ana, Ana Arguedas Gaspar (RECORTES CERO).,6,AGRUPACIÓN DE ELECTORES RECORTES CERO (RECORTES CERO),RECORTES CERO,False
621,11,Ana, Ana Isabel Brocal Hernández (RECORTES CERO).,7,AGRUPACIÓN DE ELECTORES RECORTES CERO (RECORTES CERO),RECORTES CERO,False
622,11,Ana, Ana María Luque Sillero (RECORTES CERO).,8,AGRUPACIÓN DE ELECTORES RECORTES CERO (RECORTES CERO),RECORTES CERO,False
623,11,Jordi, Jordi Martínez Rigol (RECORTES CERO).,9,AGRUPACIÓN DE ELECTORES RECORTES CERO (RECORTES CERO),RECORTES CERO,False
624,11,Francisco, Francisco Alemán Hernández (RECORTES CERO).,10,AGRUPACIÓN DE ELECTORES RECORTES CERO (RECORTES CERO),RECORTES CERO,False
625,11,Mercedes, Mercedes de la Torre Montesino (RECORTES CERO).,11,AGRUPACIÓN DE ELECTORES RECORTES CERO (RECORTES CERO),RECORTES CERO,False
626,11,Diana, Diana Plaza Sánchez (RECORTES CERO).,12,AGRUPACIÓN DE ELECTORES RECORTES CERO (RECORTES CERO),RECORTES CERO,False
627,11,Vicent, Vicent Andrés Bertí Villena (RECORTES CERO).,13,AGRUPACIÓN DE ELECTORES RECORTES CERO (RECORTES CERO),RECORTES CERO,False
628,11,Marcelo, Marcelo Armengot Iborra (RECORTES CERO).,14,AGRUPACIÓN DE ELECTORES RECORTES CERO (RECORTES CERO),RECORTES CERO,False
629,11,Oscar, Oscar Antonio Caballos Martín (RECORTES CERO).,15,AGRUPACIÓN DE ELECTORES RECORTES CERO (RECORTES CERO),RECORTES CERO,False
630,11,Marina, Marina Flox Ben (RECORTES CERO).,16,AGRUPACIÓN DE ELECTORES RECORTES CERO (RECORTES CERO),RECORTES CERO,False
631,11,Violeta, Violeta Tercedor López (RECORTES CERO).,17,AGRUPACIÓN DE ELECTORES RECORTES CERO (RECORTES CERO),RECORTES CERO,False
632,11,Jose, Jose Carlos Vázquez González (RECORTES CERO).,18,AGRUPACIÓN DE ELECTORES RECORTES CERO (RECORTES CERO),RECORTES CERO,False
633,11,Santiago, Santiago Rubio Mesa (RECORTES CERO).,19,AGRUPACIÓN DE ELECTORES RECORTES CERO (RECORTES CERO),RECORTES CERO,False
634,11,Juan, Juan López Yébenes (RECORTES CERO).,20,AGRUPACIÓN DE ELECTORES RECORTES CERO (RECORTES CERO),RECORTES CERO,False
635,11,Mercedes, Mercedes Gallego Cano (RECORTES CERO).,21,AGRUPACIÓN DE ELECTORES RECORTES CERO (RECORTES CERO),RECORTES CERO,False
636,11,Esperanza, Esperanza Rico Moral (RECORTES CERO).,22,AGRUPACIÓN DE ELECTORES RECORTES CERO (RECORTES CERO),RECORTES CERO,False
637,11,Antonio, Antonio Barba Martí (RECORTES CERO).,23,AGRUPACIÓN DE ELECTORES RECORTES CERO (RECORTES CERO),RECORTES CERO,False
638,11,Aitor, Aitor Martín Faura (RECORTES CERO).,24,AGRUPACIÓN DE ELECTORES RECORTES CERO (RECORTES CERO),RECORTES CERO,False
639,11,Santiago, Santiago Casal Ribas (RECORTES CERO).,25,AGRUPACIÓN DE ELECTORES RECORTES CERO (RECORTES CERO),RECORTES CERO,False
640,11,Ana, Ana Belén Díaz Provencio (RECORTES CERO).,26,AGRUPACIÓN DE ELECTORES RECORTES CERO (RECORTES CERO),RECORTES CERO,False
641,11,Angustias, Angustias Rodríguez García (RECORTES CERO).,27,AGRUPACIÓN DE ELECTORES RECORTES CERO (RECORTES CERO),RECORTES CERO,False
642,11,Jose, Jose María Hidalgo Mancha (RECORTES CERO).,28,AGRUPACIÓN DE ELECTORES RECORTES CERO (RECORTES CERO),RECORTES CERO,False
643,11,Jose, Jose Jaime Gómez García (RECORTES CERO).,29,AGRUPACIÓN DE ELECTORES RECORTES CERO (RECORTES CERO),RECORTES CERO,False
644,11,Angel, Angel Roldán López (RECORTES CERO).,30,AGRUPACIÓN DE ELECTORES RECORTES CERO (RECORTES CERO),RECORTES CERO,False
645,11,Rosa, Rosa Estefanía Pérez Fernández (RECORTES CERO).,31,AGRUPACIÓN DE ELECTORES RECORTES CERO (RECORTES CERO),RECORTES CERO,False
646,11,Maria, María del Carmen Galbis Estrada (RECORTES CERO).,32,AGRUPACIÓN DE ELECTORES RECORTES CERO (RECORTES CERO),RECORTES CERO,False
647,11,Sixto, Sixto Blanco Núñez (RECORTES CERO).,33,AGRUPACIÓN DE ELECTORES RECORTES CERO (RECORTES CERO),RECORTES CERO,False
648,11,Manuel, Manuel Serrano Martín (RECORTES CERO).,34,AGRUPACIÓN DE ELECTORES RECORTES CERO (RECORTES CERO),RECORTES CERO,False
649,11,Adrian, Adrián Ruíz Gavalda (RECORTES CERO).,35,AGRUPACIÓN DE ELECTORES RECORTES CERO (RECORTES CERO),RECORTES CERO,False
650,11,Maria, María Hita Muñoz (RECORTES CERO).,36,AGRUPACIÓN DE ELECTORES RECORTES CERO (RECORTES CERO),RECORTES CERO,False
651,11,Maria, María Teresa Cristóbal Sanz (RECORTES CERO).,37,AGRUPACIÓN DE ELECTORES RECORTES CERO (RECORTES CERO),RECORTES CERO,False
652,11,Jose, Jose Javier Fernández González (RECORTES CERO).,38,AGRUPACIÓN DE ELECTORES RECORTES CERO (RECORTES CERO),RECORTES CERO,False
653,11,Adrian, Adrián González Minaya (RECORTES CERO).,39,AGRUPACIÓN DE ELECTORES RECORTES CERO (RECORTES CERO),RECORTES CERO,False
654,11,Angel, Angel Vega Sánchez (RECORTES CERO).,40,AGRUPACIÓN DE ELECTORES RECORTES CERO (RECORTES CERO),RECORTES CERO,False
655,11,Concepcion, Concepción Martínez Martí (RECORTES CERO).,41,AGRUPACIÓN DE ELECTORES RECORTES CERO (RECORTES CERO),RECORTES CERO,False
656,11,Bibiana, Bibiana Fernández Navarrete (RECORTES CERO).,42,AGRUPACIÓN DE ELECTORES RECORTES CERO (RECORTES CERO),RECORTES CERO,False
657,11,Joan, Joan Enric Cunyat Tamarit (RECORTES CERO).,43,AGRUPACIÓN DE ELECTORES RECORTES CERO (RECORTES CERO),RECORTES CERO,False
658,11,Ruperto, Ruperto Agustín Matas Gutiérrez (RECORTES CERO).,44,AGRUPACIÓN DE ELECTORES RECORTES CERO (RECORTES CERO),RECORTES CERO,False
659,11,Francisco, Francisco Javier Jiménez Algora (RECORTES CERO).,45,AGRUPACIÓN DE ELECTORES RECORTES CERO (RECORTES CERO),RECORTES CERO,False
660,11,Pascuala, Pascuala Gómez Iniesta (RECORTES CERO).,46,AGRUPACIÓN DE ELECTORES RECORTES CERO (RECORTES CERO),RECORTES CERO,False
661,11,Esperanza, Esperanza Fernández Egea (RECORTES CERO).,47,AGRUPACIÓN DE ELECTORES RECORTES CERO (RECORTES CERO),RECORTES CERO,False
662,11,Jorge, Jorge Mario Eines Landman (RECORTES CERO).,48,AGRUPACIÓN DE ELECTORES RECORTES CERO (RECORTES CERO),RECORTES CERO,False
663,11,Antonio, Antonio Zarco Fortes (RECORTES CERO).,49,AGRUPACIÓN DE ELECTORES RECORTES CERO (RECORTES CERO),RECORTES CERO,False
664,11,Maximo, Máximo Sandín Domínguez (RECORTES CERO).,50,AGRUPACIÓN DE ELECTORES RECORTES CERO (RECORTES CERO),RECORTES CERO,False
665,11,Antonia, Antonia Gavilán Rodríguez (RECORTES CERO).,51,AGRUPACIÓN DE ELECTORES RECORTES CERO (RECORTES CERO),RECORTES CERO,False
666,11,Natalia, Natalia Vara Bodas (RECORTES CERO).,52,AGRUPACIÓN DE ELECTORES RECORTES CERO (RECORTES CERO),RECORTES CERO,False
667,11,Manuel, Manuel Galiana Martínez (RECORTES CERO).,53,AGRUPACIÓN DE ELECTORES RECORTES CERO (RECORTES CERO),RECORTES CERO,False
668,11,Antonio, Antonio López García (RECORTES CERO).,54,AGRUPACIÓN DE ELECTORES RECORTES CERO (RECORTES CERO),RECORTES CERO,False
669,11,Joaquin, Joaquín Torres Moreno (RECORTES CERO).,1,AGRUPACIÓN DE ELECTORES RECORTES CERO (RECORTES CERO),RECORTES CERO,True
670,11,Jesus, Jesús López Gázquez (RECORTES CERO).,2,AGRUPACIÓN DE ELECTORES RECORTES CERO (RECORTES CERO),RECORTES CERO,True
671,11,Maria, Maria Encarna Valle Fernández (RECORTES CERO).,3,AGRUPACIÓN DE ELECTORES RECORTES CERO (RECORTES CERO),RECORTES CERO,True
672,11,Maria, María del Carmen Jurado Expósito (RECORTES CERO).,4,AGRUPACIÓN DE ELECTORES RECORTES CERO (RECORTES CERO),RECORTES CERO,True
673,11,Wenceslao, Wenceslao Rebollo Cordero (RECORTES CERO).,5,AGRUPACIÓN DE ELECTORES RECORTES CERO (RECORTES CERO),RECORTES CERO,True
674,11,Roberto, Roberto González González (RECORTES CERO).,6,AGRUPACIÓN DE ELECTORES RECORTES CERO (RECORTES CERO),RECORTES CERO,True
675,11,Maria, María Begoña López Hernández (RECORTES CERO).,7,AGRUPACIÓN DE ELECTORES RECORTES CERO (RECORTES CERO),RECORTES CERO,True
676,11,Elena, Elena Sánchez Valero (RECORTES CERO).,8,AGRUPACIÓN DE ELECTORES RECORTES CERO (RECORTES CERO),RECORTES CERO,True
677,11,Antonio, Antonio González Calderón (RECORTES CERO).,9,AGRUPACIÓN DE ELECTORES RECORTES CERO (RECORTES CERO),RECORTES CERO,True
678,11,Ruben, Rubén Mateo Martínez (RECORTES CERO).,10,AGRUPACIÓN DE ELECTORES RECORTES CERO (RECORTES CERO),RECORTES CERO,True
679,12,Jordi, Jordi Sebastià Talavera (COMPROMIS).,1,PRIMAVERA EUROPEA (PRIMAVERA EUROPEA),PRIMAVERA EUROPEA,False
680,12,Florent, Florent Marcellesi (EQUO).,2,PRIMAVERA EUROPEA (PRIMAVERA EUROPEA),PRIMAVERA EUROPEA,False
681,12,Angela, Ángela Labordeta de Grandes (CHA).,3,PRIMAVERA EUROPEA (PRIMAVERA EUROPEA),PRIMAVERA EUROPEA,False
682,12,Reyes, Reyes Montiel Mesa (EQUO).,4,PRIMAVERA EUROPEA (PRIMAVERA EUROPEA),PRIMAVERA EUROPEA,False
683,12,Miguel, Miguel Prados Rodríguez (PARTICIPA).,5,PRIMAVERA EUROPEA (PRIMAVERA EUROPEA),PRIMAVERA EUROPEA,False
684,12,Ester, Ester Moreno Fernández (PCAS).,6,PRIMAVERA EUROPEA (PRIMAVERA EUROPEA),PRIMAVERA EUROPEA,False
685,12,Miguel, Miguel Ángel Vázquez Martin (PUM+J).,7,PRIMAVERA EUROPEA (PRIMAVERA EUROPEA),PRIMAVERA EUROPEA,False
686,12,Loles, Loles Ripoll Bonifacio (COMPROMIS).,8,PRIMAVERA EUROPEA (PRIMAVERA EUROPEA),PRIMAVERA EUROPEA,False
687,12,Guillermo, Guillermo Rodríguez Robles (EQUO).,9,PRIMAVERA EUROPEA (PRIMAVERA EUROPEA),PRIMAVERA EUROPEA,False
688,12,Pilar, Pilar Barrientos Ruíz (SIEX).,10,PRIMAVERA EUROPEA (PRIMAVERA EUROPEA),PRIMAVERA EUROPEA,False
689,12,Miguel, Miguel Martínez Tomey (CHA).,11,PRIMAVERA EUROPEA (PRIMAVERA EUROPEA),PRIMAVERA EUROPEA,False
690,12,Ines, Inés López-Dóriga González (EQUO).,12,PRIMAVERA EUROPEA (PRIMAVERA EUROPEA),PRIMAVERA EUROPEA,False
691,12,Joan, Joan Groizard Payeras (EQUO).,13,PRIMAVERA EUROPEA (PRIMAVERA EUROPEA),PRIMAVERA EUROPEA,False
692,12,Monica, Mónica Álvaro Cerezo (COMPROMIS).,14,PRIMAVERA EUROPEA (PRIMAVERA EUROPEA),PRIMAVERA EUROPEA,False
693,12,Mariano, Mariano Navarro de la Cruz (PCAS).,15,PRIMAVERA EUROPEA (PRIMAVERA EUROPEA),PRIMAVERA EUROPEA,False
694,12,Sonia, Sonia Ortiga Zaragaza (EQUO).,16,PRIMAVERA EUROPEA (PRIMAVERA EUROPEA),PRIMAVERA EUROPEA,False
695,12,Alberto, Alberto Martínez Cuartero (PUM+J).,17,PRIMAVERA EUROPEA (PRIMAVERA EUROPEA),PRIMAVERA EUROPEA,False
696,12,Paula, Paula María Manzano Aparisi (PARTICIPA).,18,PRIMAVERA EUROPEA (PRIMAVERA EUROPEA),PRIMAVERA EUROPEA,False
697,12,Mohamed, Mohamed Mohamed Ali (CABALLAS).,19,PRIMAVERA EUROPEA (PRIMAVERA EUROPEA),PRIMAVERA EUROPEA,False
698,12,Isabel, Isabel Martín Gómez (COMPROMIS).,20,PRIMAVERA EUROPEA (PRIMAVERA EUROPEA),PRIMAVERA EUROPEA,False
699,12,Aitor, Aitor Urresti González (EQUO).,21,PRIMAVERA EUROPEA (PRIMAVERA EUROPEA),PRIMAVERA EUROPEA,False
700,12,Maria, María Rosa Martínez Rodríguez (EQUO).,22,PRIMAVERA EUROPEA (PRIMAVERA EUROPEA),PRIMAVERA EUROPEA,False
701,12,Julia, Julià Álvaro Prat (COMPROMIS).,23,PRIMAVERA EUROPEA (PRIMAVERA EUROPEA),PRIMAVERA EUROPEA,False
702,12,Joana, Joana Pascual Gil (COMPROMIS).,24,PRIMAVERA EUROPEA (PRIMAVERA EUROPEA),PRIMAVERA EUROPEA,False
703,12,Chuse, Chusé Inazio Felices Maicas (CHA).,25,PRIMAVERA EUROPEA (PRIMAVERA EUROPEA),PRIMAVERA EUROPEA,False
704,12,Nikolina, Nikolina Dimitrov (EQUO).,26,PRIMAVERA EUROPEA (PRIMAVERA EUROPEA),PRIMAVERA EUROPEA,False
705,12,Carlos, Carlos Alberto Martins (EQUO).,27,PRIMAVERA EUROPEA (PRIMAVERA EUROPEA),PRIMAVERA EUROPEA,False
706,12,Reis, Reis Gallego Perales (COMPROMIS).,28,PRIMAVERA EUROPEA (PRIMAVERA EUROPEA),PRIMAVERA EUROPEA,False
707,12,Roberto, Roberto Moncho Agud (PARTICIPA).,29,PRIMAVERA EUROPEA (PRIMAVERA EUROPEA),PRIMAVERA EUROPEA,False
708,12,Marta, Marta Carrés Piera (CHA).,30,PRIMAVERA EUROPEA (PRIMAVERA EUROPEA),PRIMAVERA EUROPEA,False
709,12,Joaquin, Joaquín Arce Fernández (EQUO).,31,PRIMAVERA EUROPEA (PRIMAVERA EUROPEA),PRIMAVERA EUROPEA,False
710,12,Susana, Susana Bruna Pérez (SIEX).,32,PRIMAVERA EUROPEA (PRIMAVERA EUROPEA),PRIMAVERA EUROPEA,False
711,12,Pedro, Pedro Sánchez Gil (COMPROMIS).,33,PRIMAVERA EUROPEA (PRIMAVERA EUROPEA),PRIMAVERA EUROPEA,False
712,12,Carolina, Carolina López García (EQUO).,34,PRIMAVERA EUROPEA (PRIMAVERA EUROPEA),PRIMAVERA EUROPEA,False
713,12,Vicent, Vicent Xavier Vila Mas (COMPROMIS).,35,PRIMAVERA EUROPEA (PRIMAVERA EUROPEA),PRIMAVERA EUROPEA,False
714,12,Anna, Anna Climent Montllor (COMPROMIS).,36,PRIMAVERA EUROPEA (PRIMAVERA EUROPEA),PRIMAVERA EUROPEA,False
715,12,Mateo, Mateo Rafael Quirós Hernández (EQUO).,37,PRIMAVERA EUROPEA (PRIMAVERA EUROPEA),PRIMAVERA EUROPEA,False
716,12,Moraia, Moraia Grau López (EQUO).,38,PRIMAVERA EUROPEA (PRIMAVERA EUROPEA),PRIMAVERA EUROPEA,False
717,12,Arturo, Arturo Angulo Urarte (PUM+J).,39,PRIMAVERA EUROPEA (PRIMAVERA EUROPEA),PRIMAVERA EUROPEA,False
718,12,Maria, María José Pérez Noe (CHA).,40,PRIMAVERA EUROPEA (PRIMAVERA EUROPEA),PRIMAVERA EUROPEA,False
719,12,Alberto, Alberto Villa Molina (EQUO).,41,PRIMAVERA EUROPEA (PRIMAVERA EUROPEA),PRIMAVERA EUROPEA,False
720,12,Noelia, Noelia Seller Fernández (EQUO).,42,PRIMAVERA EUROPEA (PRIMAVERA EUROPEA),PRIMAVERA EUROPEA,False
721,12,Julio, Julio Ramón Echazarra San Martín (PCAS).,43,PRIMAVERA EUROPEA (PRIMAVERA EUROPEA),PRIMAVERA EUROPEA,False
722,12,Maria, María Teresa Vizcaíno Callejón (PARTICIPA).,44,PRIMAVERA EUROPEA (PRIMAVERA EUROPEA),PRIMAVERA EUROPEA,False
723,12,Antonio, Antonio Vicente García Díez (COMPROMIS).,45,PRIMAVERA EUROPEA (PRIMAVERA EUROPEA),PRIMAVERA EUROPEA,False
724,12,Anna, Anna Perpiñà Zaragozà (COMPROMIS).,46,PRIMAVERA EUROPEA (PRIMAVERA EUROPEA),PRIMAVERA EUROPEA,False
725,12,Ramon, Ramón Fernández Barba (EQUO).,47,PRIMAVERA EUROPEA (PRIMAVERA EUROPEA),PRIMAVERA EUROPEA,False
726,12,Monica, Mónica Monteagudo Casas (EQUO).,48,PRIMAVERA EUROPEA (PRIMAVERA EUROPEA),PRIMAVERA EUROPEA,False
727,12,Mariano, Mariano Fuente Blanco (PCAS).,49,PRIMAVERA EUROPEA (PRIMAVERA EUROPEA),PRIMAVERA EUROPEA,False
728,12,Maria, María del Mar Ruiz Baños (PUM+J).,50,PRIMAVERA EUROPEA (PRIMAVERA EUROPEA),PRIMAVERA EUROPEA,False
729,12,Nicolas, Nicolás Paz Alcalde (EQUO).,51,PRIMAVERA EUROPEA (PRIMAVERA EUROPEA),PRIMAVERA EUROPEA,False
730,12,Maria, María Hontanares Arranz Peña (EQUO).,52,PRIMAVERA EUROPEA (PRIMAVERA EUROPEA),PRIMAVERA EUROPEA,False
731,12,Albert, Albert Furió Pérez (COMPROMIS).,53,PRIMAVERA EUROPEA (PRIMAVERA EUROPEA),PRIMAVERA EUROPEA,False
732,12,Pilar, Pilar Calpena Poveda (COMPROMIS).,54,PRIMAVERA EUROPEA (PRIMAVERA EUROPEA),PRIMAVERA EUROPEA,False
733,12,Rafael, Rafael Conde Melguizo (EQUO).,1,PRIMAVERA EUROPEA (PRIMAVERA EUROPEA),PRIMAVERA EUROPEA,True
734,12,Maria, María del Carmen Ruíz Conde (CHA).,2,PRIMAVERA EUROPEA (PRIMAVERA EUROPEA),PRIMAVERA EUROPEA,True
735,12,Vicente, Vicente Torres Castejón (COMPROMIS).,3,PRIMAVERA EUROPEA (PRIMAVERA EUROPEA),PRIMAVERA EUROPEA,True
736,12,Maria, María José Ortiz Noguera (EQUO).,4,PRIMAVERA EUROPEA (PRIMAVERA EUROPEA),PRIMAVERA EUROPEA,True
737,12,Maria, María Luz Monllor Mollà (COMPROMIS).,5,PRIMAVERA EUROPEA (PRIMAVERA EUROPEA),PRIMAVERA EUROPEA,True
738,12,Manuel, Manuel Soria González (EQUO).,6,PRIMAVERA EUROPEA (PRIMAVERA EUROPEA),PRIMAVERA EUROPEA,True
739,12,Carolina, Carolina García Tomás (EQUO).,7,PRIMAVERA EUROPEA (PRIMAVERA EUROPEA),PRIMAVERA EUROPEA,True
740,12,Juan, Juan Leopoldo Torres Rodríguez.,8,PRIMAVERA EUROPEA (PRIMAVERA EUROPEA),PRIMAVERA EUROPEA,True
741,12,Josep, Josep M. Aparici Cubells (COMPROMIS).,9,PRIMAVERA EUROPEA (PRIMAVERA EUROPEA),PRIMAVERA EUROPEA,True
742,12,Dolores, Dolores Tobío Sueiro (EQUO).,10,PRIMAVERA EUROPEA (PRIMAVERA EUROPEA),PRIMAVERA EUROPEA,True
743,13,Jose, José María Gijón Polo.,1,EXTREMADURA UNIDA,EXTREMADURA UNIDA,False
744,13,Maxima, Máxima Gutierro Cuadrado.,2,EXTREMADURA UNIDA,EXTREMADURA UNIDA,False
745,13,Jorge, Jorge Durán Domínguez.,3,EXTREMADURA UNIDA,EXTREMADURA UNIDA,False
746,13,Maria, María Luz Regidor Mateos.,4,EXTREMADURA UNIDA,EXTREMADURA UNIDA,False
747,13,Francisco, Francisco José Gutiérrez Delgado.,5,EXTREMADURA UNIDA,EXTREMADURA UNIDA,False
748,13,Maria, María Teresa Rivero Rubio.,6,EXTREMADURA UNIDA,EXTREMADURA UNIDA,False
749,13,Francisco, Francisco Duque Galeano.,7,EXTREMADURA UNIDA,EXTREMADURA UNIDA,False
750,13,Natividad, Natividad Farrona Barrero.,8,EXTREMADURA UNIDA,EXTREMADURA UNIDA,False
751,13,Oscar, Óscar Solís Merino.,9,EXTREMADURA UNIDA,EXTREMADURA UNIDA,False
752,13,Maria, María Guadalupe Victoria Díaz Martín.,10,EXTREMADURA UNIDA,EXTREMADURA UNIDA,False
753,13,Jose, José Luis Poderoso Cortijo.,11,EXTREMADURA UNIDA,EXTREMADURA UNIDA,False
754,13,Cristina, Cristina Solís de San Nicolás.,12,EXTREMADURA UNIDA,EXTREMADURA UNIDA,False
755,13,Candido, Cándido Javier Gil Pizarro.,13,EXTREMADURA UNIDA,EXTREMADURA UNIDA,False
756,13,Isabel, Isabel María Rodríguez Guerrero.,14,EXTREMADURA UNIDA,EXTREMADURA UNIDA,False
757,13,Jorge, Jorge Alejandro Taramasco Casales.,15,EXTREMADURA UNIDA,EXTREMADURA UNIDA,False
758,13,Maria, María Izquierdo Ramiro.,16,EXTREMADURA UNIDA,EXTREMADURA UNIDA,False
759,13,Jorge, Jorge Gómez Esteban.,17,EXTREMADURA UNIDA,EXTREMADURA UNIDA,False
760,13,Maria, María Caridad Albellán Teno.,18,EXTREMADURA UNIDA,EXTREMADURA UNIDA,False
761,13,Blas, Blas Rosa Díaz.,19,EXTREMADURA UNIDA,EXTREMADURA UNIDA,False
762,13,Maria, María Luisa Cañada Valverde.,20,EXTREMADURA UNIDA,EXTREMADURA UNIDA,False
763,13,Angel, Ángel Santos Bravo Gómez.,21,EXTREMADURA UNIDA,EXTREMADURA UNIDA,False
764,13,Leonor, Leonor Cáceres Sánchez.,22,EXTREMADURA UNIDA,EXTREMADURA UNIDA,False
765,13,Antonio, Antonio Sosa Vizcaino.,23,EXTREMADURA UNIDA,EXTREMADURA UNIDA,False
766,13,Maria, María Reyes Calvo Gutierro.,24,EXTREMADURA UNIDA,EXTREMADURA UNIDA,False
767,13,Rodrigo, Rodrigo Domínguez Hoyas.,25,EXTREMADURA UNIDA,EXTREMADURA UNIDA,False
768,13,Maria, María Ángeles Lozano López.,26,EXTREMADURA UNIDA,EXTREMADURA UNIDA,False
769,13,Jose, José Campos Carlos.,27,EXTREMADURA UNIDA,EXTREMADURA UNIDA,False
770,13,Maria, María Goretti Pacheco Rentero.,28,EXTREMADURA UNIDA,EXTREMADURA UNIDA,False
771,13,Ricardo, Ricardo Ordóñez Barrena.,29,EXTREMADURA UNIDA,EXTREMADURA UNIDA,False
772,13,Maria, María Raquel Díaz Andrada.,30,EXTREMADURA UNIDA,EXTREMADURA UNIDA,False
773,13,Jose, José Luís Escobar Mendoza.,31,EXTREMADURA UNIDA,EXTREMADURA UNIDA,False
774,13,Adriana, Adriana Bote Mena.,32,EXTREMADURA UNIDA,EXTREMADURA UNIDA,False
775,13,Tomas, Tomás Alonso Fuentes.,33,EXTREMADURA UNIDA,EXTREMADURA UNIDA,False
776,13,Maria, María Aranzazu Rincón Muriel.,34,EXTREMADURA UNIDA,EXTREMADURA UNIDA,False
777,13,Juan, Juan Alfonso Leo Muñoz.,35,EXTREMADURA UNIDA,EXTREMADURA UNIDA,False
778,13,Maria, María de la Montaña Díaz Díaz.,36,EXTREMADURA UNIDA,EXTREMADURA UNIDA,False
779,13,Javier, Javier Durán Buenvarón.,37,EXTREMADURA UNIDA,EXTREMADURA UNIDA,False
780,13,Ana, Ana Belén Cañamero Morato.,38,EXTREMADURA UNIDA,EXTREMADURA UNIDA,False
781,13,Alejandro, Alejandro Jiménez Gijón.,39,EXTREMADURA UNIDA,EXTREMADURA UNIDA,False
782,13,Alba, Alba Inmaculada Álvarez Álvarez.,40,EXTREMADURA UNIDA,EXTREMADURA UNIDA,False
783,13,Jose, José Luís Barroso López.,41,EXTREMADURA UNIDA,EXTREMADURA UNIDA,False
784,13,Maria, María Dolores Rey García.,42,EXTREMADURA UNIDA,EXTREMADURA UNIDA,False
785,13,Agapito, Agapito Rosas Sánchez.,43,EXTREMADURA UNIDA,EXTREMADURA UNIDA,False
786,13,Maria, María del Pilar Búrdalo Fernández.,44,EXTREMADURA UNIDA,EXTREMADURA UNIDA,False
787,13,Francisco, Francisco Miguel López Bermejo.,45,EXTREMADURA UNIDA,EXTREMADURA UNIDA,False
788,13,Maria, María Cuadrado Vicente.,46,EXTREMADURA UNIDA,EXTREMADURA UNIDA,False
789,13,Juan, Juan José Sánchez Burcio.,47,EXTREMADURA UNIDA,EXTREMADURA UNIDA,False
790,13,Maria, María Pilar Andrada Gíl.,48,EXTREMADURA UNIDA,EXTREMADURA UNIDA,False
791,13,Juan, Juan Francisco Muñoz Mateos.,49,EXTREMADURA UNIDA,EXTREMADURA UNIDA,False
792,13,Ana, Ana Esther Nieto Ramiro.,50,EXTREMADURA UNIDA,EXTREMADURA UNIDA,False
793,13,Ismael, Ismael García López.,51,EXTREMADURA UNIDA,EXTREMADURA UNIDA,False
794,13,Juliana, Juliana Mateos Montes.,52,EXTREMADURA UNIDA,EXTREMADURA UNIDA,False
795,13,Maria, María Concepción Domínguez Moreno.,53,EXTREMADURA UNIDA,EXTREMADURA UNIDA,False
796,13,Pedro, Pedro Cañada Castillo.,54,EXTREMADURA UNIDA,EXTREMADURA UNIDA,False
797,13,Maria, María Isabel Navarro Colom.,1,EXTREMADURA UNIDA,EXTREMADURA UNIDA,True
798,13,Manuel, Manuel Díaz Lindo.,2,EXTREMADURA UNIDA,EXTREMADURA UNIDA,True
